,original_index,context_translated,question_translated,text_translated
469,9474,"බොහෝ පක්ෂීන්ට පියාසර කළ හැකි අතර එමඟින් අනෙකුත් පෘෂ් b වංශී පංති වලින් වෙන්කර හඳුනාගත හැකිය. පියාසර කිරීම බොහෝ පක්ෂි විශේෂ සඳහා දුම්රිය එන්ජින් සඳහා මූලික මාධ්‍යයක් වන අතර එය බෝ කිරීම, පෝෂණය කිරීම සහ විලෝපිකයන් වැළැක්වීම සහ පැන යාම සඳහා යොදා ගනී. සැහැල්ලු ඇටසැකිල්ලක්, විශාල පියාසර මාංශ පේශි දෙකක්, පෙක්ටෝරලිස් (කුරුල්ලන්ගේ මුළු ස්කන්ධයෙන් 15% ක් පමණ දායක වේ) සහ සුපර්කොරකොයිඩියස් මෙන්ම නවීකරණය කරන ලද නළල (පියාපත්) ඇතුළුව කුරුල්ලන්ට පියාසර කිරීම සඳහා විවිධ අනුවර්තන ඇත. aerofoil. පියාපත් හැඩය සහ ප්‍රමාණය සාමාන්‍යයෙන් කුරුලු විශේෂයක පියාසැරි වර්ගය තීරණය කරයි; බොහෝ පක්ෂීන් බලශක්තියෙන් හා වේගයෙන් පියාසර කරන ගුවන් ගමන් සමඟ අඩු ශක්තියක් සහිත ඉහළ යන පියාසරයක් ඒකාබද්ධ කරයි. වඳ වී ගොස් ඇති බොහෝ පක්ෂීන් මෙන් දැනට පවතින පක්ෂි විශේෂ 60 ක් පමණ පියාසර රහිත ය. හුදකලා දූපත් වල කුරුල්ලන් තුළ පියාසර කිරීම බොහෝ විට පැන නගින්නේ බොහෝ විට සීමිත සම්පත් සහ ඉඩම් විලෝපිකයන් නොමැති වීම හේතුවෙනි. පියාසර රහිත වුවද, පෙන්ගුවින් වරුන්, ෂියර් වෝටර් සහ ඩිපර් වැනි ජලයෙන් “පියාසර” කිරීමට සමාන මාංශ පේශි හා චලනයන් භාවිතා කරයි. පියාසර රහිත වුවද, පෙන්ගුවින් වරුන්, ෂියර් වෝටර් සහ ඩිපර් වැනි ජලයෙන් “පියාසර” කිරීමට සමාන මාංශ පේශි හා චලනයන් භාවිතා කරයි.",බොහෝ පක්ෂි විශේෂ සඳහා දුම්රිය එන්ජින් සඳහා මූලික මාධ්‍යය කුමක්ද?,පියාසැරිය
470,9475,"ක්‍රි.ව. 663 දී ටැන්ග් චීනයට සහ සිල්ලාට එරෙහි හකුසුකිනෝ සටනින් පසු ජපානය කොරියානු කටයුතුවලින් පසුබැසීමට හේතු විය. වැදගත්ම දෙය නම් ක්‍රි.ව. 646 දී නාකා නො කුමරු (ටෙන්ජි අධිරාජ්‍යයා) විසින් නිකුත් කරන ලද තායිකා ප්‍රතිසංස්කරණයයි. මෙම ආ ict ාව ජපාන වංශාධිපතියන්ට ටැන්ග් රාජවංශයේ දේශපාලන ව්‍යුහය, නිලධාරිවාදය, සංස්කෘතිය, ආගම සහ දර්ශනය අනුගමනය කිරීමට ඉඩ ලබා දුන්නේය. ක්‍රි.ව. 702 දී තායිහා සංග්‍රහයේ සහ පසුව යාරේ සංග්‍රහයේ කොටසක් ලෙස, ජනගහනය අනිවාර්යයෙන් සංගණනය සඳහා වාර්තා කිරීම අවශ්‍ය විය. ජනගහනය බෙදා හරින ආකාරය පිළිබඳ අවබෝධයක් ඇතිව, මම්මු අධිරාජ්‍යයා වැඩිහිටි පුරුෂයින් 3-4 දෙනෙකුගෙන් එක් අයෙකු ජාතික හමුදාවට බඳවා ගැනීමේ නීතියක් හඳුන්වා දුන්නේය. මෙම සොල්දාදුවන්ට තමන්ගේම ආයුධ සැපයීමට අවශ්‍ය වූ අතර, ඒ වෙනුවට තීරුබදු සහ බදු වලින් නිදහස් විය. මෙය චීන ක්‍රමයට අනුකූලව සංවිධානාත්මක හමුදාවක් පිහිටුවීමට අධිරාජ්‍ය රජය ගත් පළමු උත්සාහයන්ගෙන් එකකි. පසුකාලීන ඉතිහාස ians යින් විසින් එය ""ගුන්ඩාන්-සේයි"" (軍 団 called) ලෙස හැඳින්වූ අතර එය කෙටිකාලීන යැයි විශ්වාස කෙරේ. [උපුටා දැක්වීම අවශ්‍යයි] [උපුටා දැක්වීම අවශ්‍යයි]",හකුසුකිනෝ සටනේ බලපෑම කුමක්ද?,ජපන් ජාතිකයින් කොරියානු කටයුතුවලින් පසුබැසීමක්
471,9476,1918 පෙබරවාරියේදී ඔහු ක්‍රැන්වෙල් හි රාජකීය නාවික ගුවන් සේවයේ පුහුණු ආයතනයේ පිරිමි භාර නිලධාරී ලෙස පත් කරන ලදී. මාස දෙකකට පසු රාජකීය ගුවන් හමුදාව පිහිටුවීම සහ ක්‍රැන්වෙල් නාවික හමුදාවේ සිට ගුවන් හමුදා පාලනයට මාරු කිරීමත් සමඟ ඔහු රාජකීය නාවික හමුදාවේ සිට රාජකීය ගුවන් හමුදාවට මාරු විය. 1918 අගෝස්තු දක්වා ක්‍රැන්වෙල් හි පිරිමි අංශයේ අංක 4 බල Squ ණය නිලධාරියා ලෙස ඔහු පත් කරන ලදී. රාජකීය පවුලේ පූර්ණ සුදුසුකම් ලත් ගුවන් නියමුවෙකු ලෙස සහතික කළ පළමු සාමාජිකයා ඔහු විය. යුද්ධයේ අවසාන සති කිහිපය තුළ ඔහු ප්‍රංශයේ නැන්සි හි මූලස්ථානයේ RAF හි ස්වාධීන ගුවන් හමුදාවේ කාර්ය මණ්ඩලයේ සේවය කළේය. 1918 නොවැම්බරයේ ස්වාධීන ගුවන් හමුදාව විසුරුවා හැරීමෙන් පසු ඔහු නැවත බ්‍රිතාන්‍යයට යවන තෙක් රාජකීය ගුවන් හමුදාවේ මාණ්ඩලික නිලධාරියෙකු ලෙස මාස දෙකක් මහාද්වීපයේ රැඳී සිටියේය. ඔහු නොවැම්බර් 22 වන දින බෙල්ජියම් අධිරාජ්‍යයා වූ ඇල්බට් රජු සමඟ බ්‍රසල්ස් වෙත නැවත පැමිණියේය. ඇල්බට් කුමරු 1919 ජූලි 31 වන දින RAF නියමුවෙකු ලෙස සුදුසුකම් ලබා ඇති අතර පසුදින ස්කොඩ්‍රන් නායකයා ලෙස උසස්වීමක් ලබා ගත්තේය. ඇල්බට් කුමරු 1919 ජූලි 31 වන දින RAF නියමුවෙකු ලෙස සුදුසුකම් ලබා ඇති අතර පසුදින ස්කොඩ්‍රන් නායකයා ලෙස උසස්වීමක් ලබා ගත්තේය.,1918 දී බෙල්ජියමේ රජු කවුද?,ඇල්බට් රජු
472,9477,ඇල්බට් රජු... රිච්මන්ඩ්හි රෝමානු කතෝලික රදගුරු පදවියේ මව් පල්ලිය වන Sac තිහාසික පූජනීය හදවතේ ආසන දෙව්මැදුරද මෙම නගරය සතුය.,පැරණිතම කතෝලික පල්ලිය රිච්මන්ඩ් හි විවෘත කළ දිනය කුමක්ද?,1834 මැයි 25
473,9478,1834 මැයි 25... වැඩිහිටියන්ගේ නිශාචර ආහාර පුරුදු ද විලෝපිකයන්ගෙන් සැඟවී සිටීමට ෆස්මෝටෝඩියාට උපකාර කරයි.,Crysomelidae යනු කුමක්ද?,කොළ කුරුමිණියන්
474,9479,"පළමුවන ලෝක සංග්‍රාමයෙන් පසු කෙටි කාලයක් සඳහා රුසියානු අධිරාජ්‍යය බිඳී යාමෙන් පසුව, 1918 සිට 1920 දක්වා ආර්මේනියාව ස්වාධීන ජනරජයක් විය. 1920 අගභාගයේදී රතු හමුදාව විසින් ආර්මේනියාව ආක්‍රමණය කිරීමෙන් පසු කොමියුනිස්ට්වාදීන් බලයට පත් වූ අතර 1922 දී ආර්මේනියාව සෝවියට් සංගමයේ ට්‍රාන්ස්කාකේසියානු එස්එෆ්එස්ආර් හි කොටසක් බවට පත් වූ අතර පසුව ආර්මේනියානු සෝවියට් සමාජවාදී ජනරජය පිහිටුවන ලදි (1936 සිට 1991 සැප්තැම්බර් 21 දක්වා) . 1991 දී ආර්මේනියාව සෝවියට් සංගමයෙන් නිදහස ප්‍රකාශයට පත් කළ අතර දෙවන ආර්මේනියා ජනරජය පිහිටුවන ලදී. 1991 දී ආර්මේනියාව සෝවියට් සංගමයෙන් නිදහස ප්‍රකාශයට පත් කළ අතර දෙවන ආර්මේනියා ජනරජය පිහිටුවන ලදී.",සෝවියට් සමාජවාදී සමූහාණ්ඩුවේ කුමන කොටසද?,ට්‍රාන්ස්කාකේසියානු එස්එෆ්එස්ආර්
475,9480,"BYU සහ සමස්තයක් ලෙස t ටා නිම්නය වෙත පැමිණෙන බොහෝ අමුත්තන් සංස්කෘතිකමය වශයෙන් ගතානුගතික පරිසරය ගැන පුදුමයට පත්වන බව වාර්තා කරති. BYU හි ඉගෙනීමේ කොන්දේසියක් ලෙස සියලුම BYU සිසුන් අනුගමනය කිරීමට එකඟ වන බ්‍රිජ්හැම් යන්ග් විශ්ව විද්‍යාලයේ ගෞරව සංග්‍රහය, මත්පැන්, දුම්කොළ ආදිය පරිභෝජනය තහනම් කරයි. “එල්ඩීඑස් පල්ලියේ සභාපති ගෝර්ඩන් බී. හින්ක්ලි විසින් ආඩම්බරයෙන් අදහස් දැක්වූ ගෞරවයක් වසර ගණනාවක් පුරා ජාතිය තුළ ක්‍රියාත්මක වේ. BYU හි 2014 ""# 1 ගල් සීතල"" සන්සුන් ශ්‍රේණිගත කිරීම අඛණ්ඩව එම 17 වන වසර සනිටුහන් කළේ පාසල එම ශ්‍රේණිගත කිරීම ලබා ඇති බැවිනි. BYU විසින් මෙම සහ වෙනත් ගෞරවයන් පාසලට ප්‍රචාරය කිරීම සඳහා අනාගත සිසුන්ට ප්‍රචාරය කිරීම සඳහා යොදා ගෙන ඇති අතර, BYU ශ්‍රේණිගත කිරීම පිළිබඳව ආඩම්බර වන බව පෙන්නුම් කරයි. ඒකාකාරී අපරාධ වාර්තාවලට අනුව, ප්‍රොවෝ හි අපරාධ සිදුවීම් ජාතික සාමාන්‍යයට වඩා අඩු ය. මිනීමැරීම දුර්ලභ වන අතර මංකොල්ලකෑම් ජාතික සාමාන්‍යයෙන් 1/10 ක් පමණ වේ. බිස්නස් ඉන්සයිඩර් විසින් BYU ජාතියේ # 1 ආරක්ෂිතම විශ්ව විද්‍යාල ලෙස ශ්‍රේණිගත කර ඇත. බිස්නස් ඉන්සයිඩර් විසින් ජාතියේ # 1 ආරක්ෂිතම විශ්ව විද්‍යාල ලෙස BYU ශ්‍රේණිගත කර ඇත.",වසර ගණනාවක් තිස්සේ BYU ජාතියේ # 1 සීතල සන්සුන් පාසල ලෙස ඇගයීමට ලක් කළේ කවුද?,ප්‍රින්ස්ටන් සමාලෝචනය
476,9481,දෙවන මුරාඩ්ගේ පුත් මෙහමඩ් ජයග්‍රාහකයා රාජ්‍යය සහ හමුදාව ප්‍රතිසංවිධානය කළ අතර 1453 මැයි 29 වන දින කොන්ස්ටන්ටිනෝපල් යටත් කර ගත්තේය. බටහිර යුරෝපයේ රාජ්‍යයන් සහ පසුකාලීන බයිසැන්තියානු අධිරාජ්‍යය අතර අයහපත් සබඳතා නිසා ඕතඩොක්ස් ජනගහනයෙන් බහුතරයක් ඔටෝමාන් පාලනය වෙනිසියානු පාලනයට වඩා සුදුසු යැයි පිළිගත්තේය. ඉතාලි අර්ධද්වීපයේ ඔටෝමාන් ව්‍යාප්තියට ඇල්බේනියානු ප්‍රතිරෝධය විශාල බාධාවක් විය. ඉතාලි අර්ධද්වීපයේ ඔටෝමාන් ව්‍යාප්තියට ඇල්බේනියානු ප්‍රතිරෝධය විශාල බාධාවක් විය.,ඔටෝමාන් අධිරාජ්‍යයේ අධිකාරය පිළිගැනීම සඳහා ඕතඩොක්ස් පල්ලියට ලැබුණේ කුමක්ද?,එහි ස්වාධීනත්වය සහ භූමිය
477,9482,"හයවන හෙන්රි බලයෙන් පහ කරන විට දේවස්ථානයේ ඉදිකිරීම්, මුලින් ම අදහස් කළේ දෙගුණයකටත් වඩා දිගු, දහඅටක් හෝ සමහර විට දාහත් - බේස් (අද අටක් ඇත). සම්පූර්ණ කරන ලද්දේ අපේක්ෂිත ගොඩනැගිල්ලේ Quire පමණි. ඊටන්ගේ පළමු ප්‍රධාන ගුරුවරයා වන ඔක්ස්ෆර්ඩ් හි මැග්ඩලන් විද්‍යාලයේ නිර්මාතෘ සහ කලින් වින්චෙස්ටර් විද්‍යාලයේ ප්‍රධාන ගුරුවරයා වූ විලියම් වේන්ෆ්ලෙට් අද දේවස්ථානය නිම කරන පෙර දේවස්ථානය ඉදි කළේය. වර්තමාන පාසල් අංගනයේ චැපල්හි සහ ගඩොල් උතුරු පරාසයේ ඇති වැදගත් බිත්ති සිතුවම් ද 1480 ගණන්වල සිට පැවත එන්නකි. 1441 සිට 1460 දක්වා කාලය තුළ විද්‍යාලයීය ශාලාව ඇතුළුව සළුවෙහි පහළ මහල ඉදිකර ඇත. වර්තමාන පාසල් අංගනයේ චැපල්හි සහ ගඩොල් උතුරු පරාසයේ ඇති වැදගත් බිත්ති සිතුවම් ද 1480 ගණන්වල සිට පැවත එන්නකි. 1441 සිට 1460 දක්වා කාලය තුළ විද්‍යාලයීය ශාලාව ඇතුළුව සළුවෙහි පහළ මහල ඉදිකර ඇත.",විද්‍යාල ශාලාව ඉදිකරන ලද්දේ කුමන වසර අතරද?,1441 සහ 1460
478,9483,"හෙන්රි කලාගාරය 1927 දී විවෘත කරන ලදී, එය වොෂිංටන් හි පළමු මහජන කලා කෞතුකාගාරයයි. සියැටල් කලා කෞතුකාගාරය (SAM) 1933 දී විවෘත විය; SAM 1991 දී කෞතුකාගාරයක් විවෘත කළේය (2007 දී පුළුල් කර නැවත විවෘත කරන ලදි); 1991 සිට 1933 ගොඩනැගිල්ල SAM හි සියැටල් ආසියානු කලා කෞතුකාගාරය (SAAM) වේ. SAM ඔලිම්පික් මූර්ති උද්‍යානය (2007 දී විවෘත කරන ලදි) නගර කුළුණට උතුරින් පිහිටි ජලාශයේ ද ක්‍රියාත්මක වේ. ෆ්‍රයි කලා කෞතුකාගාරය යනු පළමු කන්දෙහි නොමිලේ කෞතුකාගාරයකි. කලාපීය ඉතිහාස එකතුව ඇල්කිහි ලොග්හවුස් කෞතුකාගාරය, ක්ලෝන්ඩිකේ ගෝල්ඩ් රෂ් ජාතික Park තිහාසික උද්‍යානය, ඉතිහාසය හා කර්මාන්ත කෞතුකාගාරය සහ ස්වාභාවික ඉතිහාසය හා සංස්කෘතික බර්ක් කෞතුකාගාරය යන ස්ථානවල ඇත. කර්මාන්ත එකතු කිරීම ලී බෝට්ටු මධ්‍යස්ථානය සහ යාබද වයඹදිග වරාය, සියැටල් මෙට්‍රොපොලිටන් පොලිස් කෞතුකාගාරය සහ පියාසැරි කෞතුකාගාරයේ ඇත. කලාපීය ජනවාර්ගික එකතු කිරීම් අතරට නෝර්ඩික් උරුම කෞතුකාගාරය, වින්ග් ලූක් ආසියානු කෞතුකාගාරය සහ වයඹ අප්‍රිකානු ඇමරිකානු කෞතුකාගාරය ඇතුළත් වේ. සියැටල් හි අවුරුදු 10 ක ප්‍රවීණ පාංශු කලාභවන සහ නවතම ක්‍රෝල් අභ්‍යවකාශ ගැලරිය ඇතුළුව කලාකරුවන් විසින් මෙහෙයවන ගැලරි ඇත. සියැටල් හි අවුරුදු 10 ක ප්‍රවීණ පාංශු කලාභවන සහ නවතම ක්‍රෝල් අභ්‍යවකාශ ගැලරිය ඇතුළුව කලාකරුවන් විසින් මෙහෙයවන ගැලරි ඇත.","ප්‍රසිද්ධියේ ක්‍රියාත්මක වන කෞතුකාගාර හැරුණු විට, සියැටල් විසින් පිරිනමනු ලබන වෙනත් පුද්ගල ගැලරි මොනවාද?",චිත්ර ශිල්පියා විසින් මෙහෙයවනු ලැබේ
479,9484,"මෙම ප්‍රදේශ ""දුඹුරු මිනිසුන්"" විසින් අල්ලාගෙන ඇති අතර East ත පෙරදිග කහ සහ අප්‍රිකාවේ කළු පැහැය ඇත. බ්‍රිතාන්‍ය අධිරාජ්‍යයේ අවසාන අවකාශය අවසන් කරමින් 1963 දී කෙන්යාව ස්වාධීන වන තෙක් වර්ණ ප්‍රශ්නය විසඳා නොතිබුණි. බ්‍රිතාන්‍ය අධිරාජ්‍යයේ අවසාන අවකාශය අවසන් කරමින් 1963 දී කෙන්යාව ස්වාධීන වන තෙක් වර්ණ ප්‍රශ්නය විසඳා නොතිබුණි.",කෙන්යාව ස්වාධීන වූයේ කවදාද?,1963
480,9485,"කෝපි පානය කරන්නන්ට වඩා තේ පානය කරන්නන් විශාල ප්‍රමාණයක් කත්මණ්ඩු සතුව ඇත. තේ බහුලව සේවය කරන නමුත් බටහිර ප්‍රමිතීන්ට අනුව එය බෙහෙවින් දුර්වල ය. එය පොහොසත් වන අතර කිරි, සීනි සහ කුළුබඩු සමග තම්බා තේ දළු අඩංගු වේ. මත්පැන් බහුලව මත්පැන් පානය කර ඇති අතර, මත්පැන් වල දේශීය ප්‍රභේද ගණනාවක් තිබේ. බීමතින් රිය පැදවීම නීති විරෝධී වන අතර බලධාරීන්ට ඉවසීමේ ප්‍රතිපත්තියක් නොමැත. අයිලා සහ ට්වොන් (සහල් වලින් සාදන ලද මධ්‍යසාර) යනු කත්මණ්ඩුහි මධ්‍යසාර පානයකි. එය සියලුම දේශීය භට්ටිවල (මධ්‍යසාර සේවය කරන ආහාරපාන) දක්නට ලැබේ. චියැන්ග්, ටොංබා (පැසුණු මෙනේරි හෝ බාර්ලි) සහ රක්ෂි යනු නේපාලයේ අනෙකුත් ප්‍රදේශවලින් එන මත්පැන් වේ. කෙසේ වෙතත්, කත්මණ්ඩු හි සාප්පු සහ බාර් බටහිර හා නේපාල බියර් බහුලව අලෙවි කරයි. කෙසේ වෙතත්, කත්මණ්ඩු හි සාප්පු සහ බාර් බටහිර හා නේපාල බියර් බහුලව අලෙවි කරයි.",Thwon සෑදීමට භාවිතා කරන්නේ කුමක්ද?,සහල්
481,9486,"මහායාන සම්ප්‍රදායට අනුව, මහායාන සූත්‍ර රහසිගතව සම්ප්‍රේෂණය කරන ලදි, වෙනත් බුදුවරුන්ගෙන් හෝ බෝධිසත්වයන්ගෙන් පැවත එන්නන් විය.",මිනිසුන් නොවන ලෝකවල සංරක්ෂණය කළ හැකි සූත්‍ර මොනවාද?,මහයාන
