,original_index,context_translated,question_translated,text_translated
228,9228,"පෙබරවාරි මස අග දී කියෙව්හි මැතිවරණ නීතිවලට විරෝධය දැක්වීමට, මාර්තු 26 වන දින යූඑස්එස්ආර් මහජන නියෝජිතයින්ගේ සම්මේලනයට මැතිවරණය ආසන්නයේ දී සහ යුක්රේනයේ කොමියුනිස්ට් පක්ෂයේ පළමු ලේකම් ඉල්ලා අස්වන ලෙස ඉල්ලා සිටීමට විශාල මහජන පෙළපාලි පැවැත්විණි. වොලොඩිමියර් ෂර්බයිට්ස්කි, ""එකතැන පල්වීමේ මාස්ටෝඩනය"" ලෙස ලාම්පු කර ඇත. පෙලපාලි සෝවියට් ජනාධිපති ගොර්බචෙව්ගේ යුක්රේනයේ සංචාරයකට සමපාත විය. 19 වන සියවසේ යුක්රේන ජාතික චිත්‍ර ශිල්පියෙකු හා ජාතිකවාදියෙකු වන ටාරස් ෂෙවෙන්කෝගේ අභාවයේ සංවත්සරය සනිටුහන් කරමින් 1989 පෙබරවාරි 26 වන දින ලිවිව් හි නොපැහැදිලි කිතුනු අනුස්මරණ දේව මෙහෙයකට 20,000 ත් 30,000 ත් අතර පිරිසක් සහභාගී වූහ. 19 වන සියවසේ යුක්රේන ජාතික චිත්‍ර ශිල්පියෙකු හා ජාතිකවාදියෙකු වන ටාරස් ෂෙවෙන්කෝගේ අභාවයේ සංවත්සරය සනිටුහන් කරමින් 1989 පෙබරවාරි 26 වන දින ලිවිව් හි නොපැහැදිලි කිතුනු අනුස්මරණ දේව මෙහෙයකට 20,000 ත් 30,000 ත් අතර පිරිසක් සහභාගී වූහ.",පෙබරවාරි මස අවසාන භාගයේදී කියෙව්හි ජනතාව විරෝධතා දැක්වූයේ කුමක් ද?,මැතිවරණ නීති
229,9229,"කුරුසපත් කිරීම හා සම්බන්ධ පුරාණ ප්‍රභවයන් සියල්ලම පාහේ සාහිත්‍යමය වුවත්, 1 වන සියවස දක්වා දිවෙන කුරුසියේ ඇණ ගසනු ලැබූ මිනිසෙකුගේ සිරුර ජෙරුසලමට ඊසාන දෙසින් පිහිටි 1968 පුරාවිද්‍යාත්මක සොයාගැනීම් මගින් රෝම යුගයේදී කුරුසපත් වීම දළ වශයෙන් සිදු වූ ආකාරය අනුව හොඳ තහවුරු කිරීමක් සපයයි. යේසුස් වහන්සේ කුරුසියේ ඇණ ගැසීම ශුභාරංචි වල විස්තර කර ඇත. කුරුසියේ ඇණ ගසනු ලැබූ පුද්ගලයා යෙහෝහානන් බෙන් හග්කොල් ලෙස හඳුනාගෙන ඇති අතර ක්‍රි.ව. 70 දී පමණ රෝමයට එරෙහිව යුදෙව් කැරැල්ල සිදුවන අවස්ථාවේදී මිය ගියේය. හදසා වෛද්‍ය විද්‍යාලයේ විශ්ලේෂණයන් ඇස්තමේන්තු කර ඇත්තේ ඔහු වයස අවුරුදු 20 දී මිය ගිය බවය. ක්‍රි.ව. 1 වන සියවස දක්වා දිවෙන තවත් අදාළ පුරාවිද්‍යාත්මක සොයාගැනීමක් නම්, හඳුනා නොගත් විලුඹ අස්ථියකි. එය ජෙරුසලමේ සොහොන් බිමක තිබී සොයා ගන්නා ලදී. ක්‍රි.ව. 1 වන සියවස දක්වා දිවෙන තවත් අදාළ පුරාවිද්‍යාත්මක සොයාගැනීමක් නම්, හඳුනා නොගත් විලුඹ අස්ථියකි. එය ජෙරුසලමේ සොහොන් බිමක තිබී සොයා ගන්නා ලදී.",බෙන් හග්කොල් කුරුසියේ ඇණ ගසනු ලැබුවේ කවදාද?,ක්‍රි.ව. 70 දී පමණ
230,9230,"දෙවන ලෝක සංග්‍රාමයෙන් පසුව බ්‍රිතාන්‍යය බ්‍රිතාන්‍ය සෝමාලිලන්ඩ් සහ ඉතාලි සෝමාලිලන්ඩ් යන දෙඅංශයේම ආරක්ෂිත ප්‍රදේශ ලෙස සිය පාලනය රඳවා ගත්තේය. 1945 දී, පොට්ස්ඩෑම් සමුළුවේදී එක්සත් ජාතීන් විසින් ඉතාලි සෝමාලිලන්ඩ් හි භාරකාරත්වය ලබා දුන් නමුත් එය සමීප අධීක්ෂණය යටතේ සහ කොන්දේසිය මත පමණි - මුලින්ම යෝජනා කළේ සෝමාලි යූත් ලීගය (SYL) සහ හිස්බියා ඩිජිල් මිරිෆල් වැනි සෝමාලියානු දේශපාලන සංවිධාන විසිනි. සෝමාලි (HDMS) සහ සෝමාලි ජාතික ලීගය (SNL) - වසර දහයක් තුළ සෝමාලියාව නිදහස ලබා ගනී. බ්‍රිතාන්‍ය සෝමාලිලන්ඩ් 1960 වන තෙක් බ්‍රිතාන්‍යයේ ආරක්ෂිත ප්‍රදේශයක් ලෙස පැවතුනි. බ්‍රිතාන්‍ය සෝමාලිලන්ඩ් 1960 වන තෙක් බ්‍රිතාන්‍යයේ ආරක්ෂිත ප්‍රදේශයක් ලෙස පැවතුනි.",ඉතාලි සෝමාලිලන්තයට ස්වාධීන වීමට ඉතාලියට කොපමණ වසරක් ගතවේද?,දහය
231,9231,"ඇල්සස්-ලොරේන් වෙත අපේක්ෂිත ජර්මානු ප්‍රහාරයෙන් ඇති වූ පීඩනය සමනය කිරීම සඳහා, තුන්වන නැපෝලියන් සහ ප්‍රංශ මහ කොමසාරිස්වරයා යුද්ධය ආරම්භ වූ වහාම උතුරු ජර්මනිය මත මුහුදු වෙරළ ආක්‍රමණය කිරීමට සැලසුම් කළහ. ප්‍රංශ හමුදාව අපේක්ෂා කළේ ආක්‍රමණය ජර්මානු හමුදා වෙනතකට හැරවීමටත්, ඩෙන්මාර්කය යුද්ධයට එක්වීමට දිරිමත් කිරීමටත්, එහි 50,000 ක හමුදාව සහ රාජකීය ඩෙන්මාර්ක නාවික හමුදාව සමඟ ය. යාර 4,000 (මීටර 3,700) ක පරාසයක් සහිත ප්‍රංශ නාවික තුවක්කු මෙන් දෙගුණයක් ඇති ක්‍රුප් බර කාලතුවක්කු සහිත වෙරළ කාලතුවක්කු බැටරි ඇතුළු විශාල උතුරු ජර්මානු වරායන් වටා ප්‍රුෂියා මෑතකදී ආරක්ෂක වළලු ඉදිකර ඇති බව සොයා ගන්නා ලදී. ප්‍රංශ නාවික හමුදාවට වෙරළාරක්ෂක කටයුතු සඳහා බර තුවක්කු නොමැති අතර ප්‍රෂියානු වෙරළ තීරයේ භූ විෂමතාව නිසා උතුරු ජර්මනිය මත මුහුදු වෙරළ ආක්‍රමණය කළ නොහැකි විය. ප්‍රංශ නාවික හමුදාවට වෙරළාරක්ෂක කටයුතු සඳහා බර තුවක්කු නොමැති අතර ප්‍රෂියානු වෙරළ තීරයේ භූ විෂමතාව නිසා උතුරු ජර්මනිය මත මුහුදු වෙරළ ආක්‍රමණය කළ නොහැකි විය.",විශාල උතුරු ජර්මානු වරායන් වටා ප්‍රුෂියාව සොයාගෙන ඇත්තේ කුමක්ද?,ආරක්ෂක
232,9232,"1721 සිට විග් දේශපාලන ician රොබට් වල්පොල් වසර විසිඑකක් ධුරය හෙබවීය. වල්පොල් කැබිනට් රැස්වීම්වල මුලසුන දැරූ අතර අනෙක් සියලුම ඇමතිවරුන් පත් කොට රාජකීය අනුග්‍රහය ලබා දුන් අතර ඔහුගේ ආධාරකරුවන් සමඟ පාර්ලිමේන්තුව ඇසුරුම් කළේය. වල්පොල යටතේ කැබිනට් සහයෝගීතාවයේ මූලධර්මය වර්ධනය විය. තමා හැර වෙනත් කිසිම ඇමතිවරයකු රජු සමඟ පෞද්ගලික ගනුදෙනු නොකළ යුතු බවත්, ප්‍රතිපත්තියක් සම්බන්ධයෙන් කැබිනට් මණ්ඩලය එකඟ වූ විට, සියලු ඇමතිවරු එය ප්‍රසිද්ධියේ ආරක්ෂා කළ යුතු බවත් නැතහොත් ඉල්ලා අස්විය යුතු බවත් වල්පොල්ට අවශ්‍ය විය. පසුකාලීන අගමැතිවරයෙකු ලෙස මෙල්බර්න් සාමිවරයා පැවසුවේ, “මහත්වරුනි, අප සියලු දෙනාම එකම දේ පවසන තාක් කල් එය අප කියන දේට වැදගත් නොවේ.” පසුකාලීන අගමැතිවරයෙකු ලෙස මෙල්බර්න් සාමිවරයා පැවසුවේ, “මහත්වරුනි, අප සියලු දෙනාම එකම දේ පවසන තාක් කල් එය අප කියන දේට වැදගත් නොවේ.”",රොබට් වල්පොල් අගමැති ලෙස කොපමණ කාලයක් සේවය කළාද?,අවුරුදු විසිඑක
233,9233,අවුරුදු විසිඑක... මේ අනුව ඩීසිගේ නීතියේ ආධිපත්‍යය හුදු ක්‍රියා පටිපාටියකට නැවත ඇතුළත් කරන ලදී.,චාල්ස් එවාන්ස් හියුස් කවුද?,එක්සත් ජනපදයේ අගවිනිසුරු
234,9234,"සැණකෙළිය හඳුන්වා දුන්නේ පෘතුගීසි පදිංචිකරුවන් විසිනි. මෙම සැමරුම සමරනු ලබන්නේ එක් එක් දූපත් සමූහයේ ජනාවාස දූපත් නවයක ය. මින්ඩෙලෝ හි, සාඕ විසෙන්ට් කණ්ඩායම් වාර්ෂික ත්‍යාගයක් සඳහා එකිනෙකාට අභියෝග කරති. එය විවිධ බ්‍රසීලියානු සැණකෙළි සම්ප්‍රදායන් ආනයනය කර ඇත. සාඕ නිකොලාවු හි සැමරුම වඩාත් සාම්ප්‍රදායික වන අතර, එහිදී රිබෙයිරා බ්‍රාවා හරහා කණ්ඩායම් පෙළපාළි ගොස් නගර චතුරශ්‍රයේ රැස්ව සිටියි. බ්‍රසීලයෙන් බෙර, පාවෙන හා ඇඳුම් පැළඳුම් භාවිතා කර ඇත. සාඕ නිකොලාවු හි කණ්ඩායම් තුනක් වන කෝපා කබානා, එස්ට්‍රෙලා අසුල් සහ බ්‍රිල්හෝ ඩා සෝනා විසින් ගින්දර, අච්චුව සඳහා පුවත්පත, යකඩ සහ වානේ ව්‍යුහය සඳහා තීන්ත ආලේප කර ඇත. සැණකෙළිය සාඕ නිකොලාවු දින තුනක් පුරා සමරනු ලැබේ: උදේ සෙනසුරාදා, ඉරිදා දහවල් සහ අඟහරුවාදා. සැණකෙළිය සාඕ නිකොලාවු දින තුනක් පුරා සමරනු ලැබේ: උදේ සෙනසුරාදා, ඉරිදා දහවල් සහ අඟහරුවාදා.",කානිවල් සමරනු ලබන්නේ ජනාවාස දූපත් කීයක්ද?,නවය
235,9235,"වැරදි අර්ථ දැක්වීමේ ශ්‍රේණියේ ප්‍රවේණි කණ්ඩායම් සමඟ වඩාත් ස්ථාවර වාර්තාවක් සලකා බැලිය යුතු නම් (උදා: ලතින් භාෂාවේ වෙනත් තැන්වල මෙන් නොව, බහු වාර්ගික එක වෙනුවට කළු කාණ්ඩයේ අප්‍රිකානු සහ අප්‍රිකානු නොවන මුතුන් මිත්තන්ගේ සමබර මට්ටමක් ඇති පුද්ගලයින් පොකුරු නොකරනු ඇත. අප්‍රිකානු සම්භවයක් ඇති ඇමරිකානුවන් තමන් මිශ්‍ර යැයි වර්ගීකරණය කිරීමට පෙළඹෙන ඇමරිකාව), වැඩි පිරිසක් බ්‍රසීලයේ සුදු හා සමාව අයැදුම්කරුවන් ලෙස වාර්තා කරනු ඇත (2010 වන විට පිළිවෙලින් 47.7% සහ 42.4%), පර්යේෂණයෙන් එහි ජනගහනය ස්වයංක්‍රීය යුරෝපීය පරම්පරාවෙන් 65 ත් 80% ත් අතර ප්‍රමාණයක් ඇතැයි විශ්වාස කෙරේ, සාමාන්‍යයෙන් (යුරෝපීය mt-DNA වලින් 35% ක් සහ යුරෝපීය Y-DNA වලින් 95% ක්). ලතින් ඇමරිකාවේ වෙනත් තැනක මෙන් නොව, අප්‍රිකානු සම්භවයක් ඇති අය තමන් මිශ්‍ර යැයි වර්ගීකරණය කිරීමට පෙළඹෙන ලතින් ඇමරිකාවේ වෙනත් තැනක මෙන් නොව, බහු වාර්ගික එක වෙනුවට අප්‍රිකානු සහ අප්‍රිකානු නොවන පරම්පරාවන් කළු ජාතික කණ්ඩායම් අතර පොකුරු නොකරනු ඇත). බ්‍රසීලයේ සුදු හා සමාව අයැදුම්කරුවන් ලෙස වාර්තා කරන්න (2010 වන විට පිළිවෙලින් 47.7% සහ 42.4%), පර්යේෂණයන් අනුව එහි ජනගහනය ස්වයංක්‍රීය යුරෝපීය පරම්පරාවෙන් 65 ත් 80% ත් අතර සංඛ්‍යාවක් සිටින බව විශ්වාස කෙරේ, සාමාන්‍යයෙන් (එසේම> 35% යුරෝපීය mt-DNA සහ> යුරෝපීය Y-DNA වලින් 95%).",බ්‍රසීලයේ ජනගහනය ස්වයංක්‍රීය යුරෝපීය පරම්පරාවේ ප්‍රතිශත අතර ඇති බව විශ්වාස කෙරේ.,65 සහ 80%
236,9236,"උතුරු චීනයේ පැතිරී ඇති නියඟය, යුරෝපීය බලවතුන්ගේ අධිරාජ්‍යවාදී සැලසුම් හා ක්විං රජයේ අස්ථාවරත්වය සමඟ එක්ව, ධර්මිෂ් and හා එකඟතා හස්තයන් නොහොත් ""බොක්සිං ක්‍රීඩකයින්"" බිහිවීමට හේතු වූ කොන්දේසි නිර්මානය කළේය. 1900 දී, ක්විං රාජවංශයට සහය ප්‍රකාශ කරන බොක්සිං කණ්ඩායම් දේශීය විදේශීය මිෂනාරිවරුන් සහ චීන ක්‍රිස්තියානීන් විශාල සංඛ්‍යාවක් dered ාතනය කළ අතර, පසුව විදේශීය නීති කාර්තුව වටලෑම සඳහා බීජිං වෙත පැමිණියහ. යුරෝපීය, ජපන් හා රුසියානු හමුදාවන්ගේ සන්ධානයක් (අට-ජාතීන්ගේ සන්ධානය) පසුව චීනයට ඇතුළු වූයේ රාජ්‍ය තාන්ත්‍රික දැනුම්දීමකින් තොරව ය. සික්සි මේ සියලු ජාතීන්ට එරෙහිව යුද්ධ ප්‍රකාශ කළේ කෙටි, නමුත් දැඩි සටනකින් පසුව බීජිනය පාලනය කර ගැනීමට පමණි. ඇය ෂියාන් වෙත පලා ගියාය. ජයග්‍රාහී සහචරයින් චීනය ආක්‍රමණය කිරීම සඳහා ඔවුන්ගේ වියදම් සඳහා වන්දි ගෙවීම සහ ඊට අනුබල දුන් නිලධාරීන් exec ාතනය කිරීම ඇතුළු ක්විං රජයට ඉල්ලීම් රාශියක් ඉදිරිපත් කළහ. ජයග්‍රාහී සහචරයින් චීනය ආක්‍රමණය කිරීම සඳහා ඔවුන්ගේ වියදම් සඳහා වන්දි ගෙවීම සහ ඊට අනුබල දුන් නිලධාරීන් exec ාතනය කිරීම ඇතුළු ක්විං රජයට ඉල්ලීම් රාශියක් ඉදිරිපත් කළහ.",බෙයිජිං හමුදාව 8 ට වැටීමෙන් පසු සික්සි ගියේ කොහේද?,ෂියාන්
237,9237,"ඩෙට්රොයිට් එක්සත් ජනපදයේ වඩාත්ම වාර්ගිකව වෙන් කරන ලද නගර වලින් එකකි. 1940 සිට 1970 දක්වා කළු ජාතිකයින්ගේ දෙවන රැල්ලක් ඩෙට්‍රොයිට් වෙත ගියේ දකුණේ ජිම් ක්‍රෝ නීතියෙන් ගැලවී රැකියා සොයා ගැනීම සඳහා ය. කෙසේවෙතත්, ප්‍රචණ්ඩත්වය, නීති සහ ආර්ථික වෙනස්කම් කිරීම (උදා. සුදු ජාතිකයන් කළු නිවාසවලට පහර දුන්හ: ජනේල කැඩීම, ගිනි ආරම්භ කිරීම සහ බෝම්බ පුපුරා යාම. වෙන් කිරීමේ රටාව පසුව තදාසන්න ප්‍රදේශවලට සුදු සංක්‍රමණය වීමෙන් විශාල විය. පංති වෙන් කිරීම සමඟ සහසම්බන්ධ වන වාර්ගික වෙන්කිරීමේ එක් ඇඟවීමක් සමහර ජනගහනය සඳහා සමස්තයක් වශයෙන් සෞඛ්‍ය සම්පන්න විය හැකිය. පංති වෙන් කිරීම සමඟ සහසම්බන්ධ වන වාර්ගික වෙන්කිරීමේ එක් ඇඟවීමක් සමහර ජනගහනය සඳහා සමස්තයක් වශයෙන් සෞඛ්‍ය සම්පන්න විය හැකිය.",ඩෙට්‍රොයිට් හි උග්‍ර වූ වෙන්වීම කුමක්ද?,තදාසන්න ප්‍රදේශවලට සුදු සංක්‍රමණය
238,9238,"දහනව වන ශතවර්ෂයේ අගභාගයේදී කළු ජාතික කොන්ග්‍රස් සභිකයින් දෙදෙනෙකු උතුරු කැරොලිනාවේ 2 වන දිස්ත්‍රික්කයෙන් තේරී පත් විය. එය අවසන් වරට 1898 දී ය. ඒවා අසාර්ථක විය. 1900 දී ප්‍රාන්ත ව්‍යවස්ථාදායකය විසින් නව ව්‍යවස්ථාවක් සම්මත කරන ලද අතර ඡන්දදායකයින් ලියාපදිංචි කිරීමේ නීතිරීති බොහෝ කළු ජාතිකයින් සහ බොහෝ දුප්පත් සුදු ජාතිකයින් ඉවත් කරන ලදී. 1908 වන විට කළු ඡන්දය බිංදුව දක්වා අඩු කිරීමට රජය සමත් විය. නුසුදුසු කළු ජාතිකයින්ට (සහ පසුකාලීන කාන්තාවන්ට) ජූරි සභාවල හිඳගෙන ඕනෑම කාර්යාලයක, ප්‍රාදේශීය, ප්‍රාන්ත හෝ ෆෙඩරල් කාර්යාලයක සේවය කිරීමෙන් ඡන්දය ප්‍රකාශ කිරීමේ හැකියාව අහිමි විය. රයිලි සහ අනෙකුත් ප්‍රදේශවල නැගී එන කළු මධ්‍යම පංතිය දේශපාලනිකව නිහ ced කර පළාත් පාලන ආයතනවලින් ඉවත් වූ අතර රිපබ්ලිකන් පක්ෂය තවදුරටත් තරඟකාරී නොවීය. 1960 ගණන්වල මැද භාගයේදී ෆෙඩරල් සිවිල් අයිතිවාසිකම් පිළිබඳ නීති සම්මත වූ පසු උතුරු කැරොලිනාවේ කළු ජාතිකයින්ගෙන් බහුතරයකට නැවත ඡන්දය ප්‍රකාශ කිරීමට, ජූරි සභාවල හිඳීමට සහ ප්‍රාදේශීය කාර්යාලවල සේවය කිරීමට හැකි වනු ඇත. 1992 වන තෙක් අප්‍රිකානු ඇමරිකානුවෙකු කොන්ග්‍රසයට තේරී පත් නොවීය. 1992 වන තෙක් කිසිදු අප්‍රිකානු ඇමරිකානුවෙක් කොන්ග්‍රසයට තේරී පත් නොවීය.",1900 දී සිදු වූයේ කුමක්ද?,ප්‍රාන්ත ව්‍යවස්ථාදායකය නව ව්‍යවස්ථාවක් සම්මත කළේය
