,original_index,context_translated,question_translated,text_translated
710,9734,"බොහෝ ඇනලයිඩ චලනය වන්නේ පෙරිස්ටල්සිස් (සංකෝචන හා ප්‍රසාරණය වන තරංග). මෙම සතුන් තුළ සෙප්ටා මඟින් එක් එක් කොටස වෙන වෙනම තරලයෙන් පිරුණු ""බැලූනයක්"" බවට පත් කිරීමෙන් රවුම් සහ කල්පවත්නා මාංශ පේශිවලට තනි කොටස්වල හැඩය වෙනස් කිරීමට හැකි වේ. කෙසේ වෙතත්, සෙප්ටා බොහෝ විට අර්ධ-අස්ථිර හෝ පෙරිස්ටල්සිස් හෝ පැරපෝඩියා වල චලනයන් මගින් චලනය නොවන ඇනලයිඩ වල අසම්පූර්ණ වේ - නිදසුනක් ලෙස ශරීරයේ චලනයන් මගින් සමහර චලනයන්, සමහර කුඩා සමුද්‍ර ජීවීන් සිලියා මගින් ගමන් කරයි (සිහින් මාංශ පේශි බලැති හිසකෙස්) සහ සමහර බරෝවර්වරු ඔවුන්ගේ ෆරින්ජස් (උගුර) පිටතට හරවා මුහුදු පතුලට විනිවිද ගොස් ඒ තුළට ඇදගෙන යති. කෙසේ වෙතත්, සෙප්ටා බොහෝ විට අර්ධ-අස්ථිර හෝ පෙරිස්ටල්සිස් හෝ පැරපෝඩියා වල චලනයන් මගින් චලනය නොවන ඇනලයිඩ වල අසම්පූර්ණ වේ - නිදසුනක් ලෙස ශරීරයේ චලනයන් මගින් සමහර චලනයන්, සමහර කුඩා සමුද්‍ර ජීවීන් සිලියා මගින් ගමන් කරයි (සිහින් මාංශ පේශි බලැති හිසකෙස්) සහ සමහර බරෝවර්වරු ඔවුන්ගේ ෆරින්ජස් (උගුර) පිටතට හරවා මුහුදු පතුලට විනිවිද ගොස් ඒ තුළට ඇදගෙන යති.",ඇනලයිඩ් වල කොටස් ජල බැලූන් මෙන් වන්නේ ඇයි?,සෙප්ටා මඟින් රවුම් සහ කල්පවත්නා මාංශ පේශිවලට තනි කොටස්වල හැඩය වෙනස් කිරීමට හැකි වේ
711,9735,"විමුක්තියෙන් දශක ගණනාවකට පසු සුදු ආධිපත්‍යය සහතික කිරීමට ඔවුන් දැරූ උත්සාහයේ දී, 20 වන සියවසේ මුල් භාගයේ දී, බොහෝ දකුණු රාජ්‍යයන් එක්-බිංදු රීතිය මත පදනම් වූ නීති සම්පාදනය කළ අතර, කළු ජාතිකයින්, ඕනෑම අප්‍රිකානු පෙළපතක් ඇති අය ලෙස අර්ථ දැක්වීය. මෙය 19 වන සියවසේ පැවති අර්ථයට වඩා දැඩි අර්ථකථනයකි; එය ප්‍රාන්තයේ බොහෝ මිශ්‍ර පවුල් නොසලකා හැර ඇති අතර පෙනුමෙන් හා ඇසුරෙන් පුද්ගලයෙකු විනිශ්චය කිරීමේ පොදුවේ පිළිගත් සමාජ නීතිවලට පටහැනි විය. සමහර උසාවි එය හැඳින්වූයේ “සොයාගත හැකි මුදල් රීතිය” ලෙසයි. මානව විද්‍යා ologists යින් එය හයිපොඩෙසන්ට් රීතියකට උදාහරණයක් ලෙස හැඳින්වූ අතර, එයින් අදහස් වන්නේ වාර්ගිකව මිශ්‍ර වූ පුද්ගලයින්ට සමාජීය වශයෙන් යටත් වූ කණ්ඩායමේ තත්වය පවරන ලද බවයි. මානව විද්‍යා ologists යින් එය හයිපොඩෙසන්ට් රීතියකට උදාහරණයක් ලෙස හැඳින්වූ අතර, එයින් අදහස් වන්නේ වාර්ගිකව මිශ්‍ර වූ පුද්ගලයින්ට සමාජීය වශයෙන් යටත් වූ කණ්ඩායමේ තත්වය පවරන ලද බවයි.",එක් බිංදු රීතිය ක්‍රියාත්මක වූයේ කවදාද?,විසිවන සියවසේ මුල් භාගයේදී
712,9736,විසිවන සියවසේ මුල් භාගයේදී,ජාන ඉංජිනේරු විද්‍යාව ඉඩ දෙන්නේ කුමක් ද?,පර්යේෂණාත්මකව වෙනස් කළ යුතු මොළයේ අණුක කොටස්;
713,9737,"ලෝක සෞඛ්‍ය සංවිධානය සහ එක්සත් ජාතීන්ගේ පරිසර වැඩසටහන ඇස්තමේන්තු කර ඇත්තේ සෑම වසරකම සංවර්ධනය වෙමින් පවතින රටවල කෘෂිකර්මාන්තයේ යෙදෙන කම්කරුවන් මිලියන 3 ක් පළිබෝධනාශක වලින් දරුණු විෂ ශරීරගත වන අතර ඉන් 18,000 ක් පමණ මිය යන බවයි. ප්‍රමාණවත් නියාමනය සහ ආරක්ෂක පියවරයන් හේතුවෙන්, පළිබෝධනාශක ආශ්‍රිත මරණ වලින් 99% ක්ම සිදුවන්නේ සංවර්ධනය වෙමින් පවතින රටවල වන අතර පළිබෝධනාශක භාවිතයෙන් 25% ක් පමණි. එක් අධ්‍යයනයකට අනුව, සංවර්ධනය වෙමින් පවතින රටවල කම්කරුවන් මිලියන 25 ක් පමණ වාර්ෂිකව සුළු පළිබෝධ නාශක විෂවීමකට ලක්විය හැකිය. කෘෂිකර්මාන්තය හැරුණු විට වෘත්තීන් කිහිපයක් ඇති අතර එමඟින් සුරතල් සතුන්, භූමි පාලකයන් සහ ධූමකාරක ඇතුළු පළිබෝධ නාශක නිරාවරණයෙන් පුද්ගලයන්ට සෞඛ්‍යමය අවදානමක් ඇතිවිය හැකිය. කෘෂිකර්මාන්තය හැරුණු විට වෘත්තීන් කිහිපයක් ඇති අතර එමඟින් සුරතල් සතුන්, භූමි පාලකයන් සහ ධූමකාරක ඇතුළු පළිබෝධ නාශක නිරාවරණයෙන් පුද්ගලයන්ට සෞඛ්‍යමය අවදානමක් ඇතිවිය හැකිය.",පළිබෝධනාශක විෂ වීම නිසා මිනිසුන් අවදානමට ලක්වන වෘත්තීන් මොනවාද?,"ගොමර්, භූමි පාලකයන් සහ ධූමකේත"
714,9738,"කතුවරයා වන ලැරී බැටළු පැටවා මුලින් කම්කරු පසුබිමක සිටි අතර සමාජවාදී හැදී වැඩීමකින් යුක්ත වූ අතර ඔහු තාවකාලිකව ආදේශ කිරීම බර්නාඩ් ශ්‍රිම්ස්ලි (1972-75) මධ්‍යම පංතියේ එකඟ නොවූ කොන්සර්වේටිව්වරයෙකි. නළු ක්‍රිස්ටෝපර් තිමෝතිගේ හ o ින් මෙම කාල පරිච්ඡේදය තුළ ITV ජාලයේ පුළුල් වෙළඳ ප්‍රචාරණ ව්‍යාපාරයක් 1978 දී ඩේලි මිරර් සංසරණය අභිබවා යාමට සූර්යයාට උදව් වන්නට ඇත. 1970 දශකයේ කාර්මික සම්බන්ධතා තිබියදීත් - ඊනියා ""ස්පා Spanish ් practices භාවිතයන්"" මුද්‍රණ සමිති - සූර්යයා ඉතා ලාභදායී වූ අතර 1973 සිට මර්ඩොක්ට සිය මෙහෙයුම් එක්සත් ජනපදයට ව්‍යාප්ත කිරීමට හැකි විය. 1970 ගණන්වල කාර්මික සම්බන්ධතා තිබියදීත් - මුද්‍රණ සංගම්වල ඊනියා ""ස්පා Spanish ් practices භාවිතයන්"" - සූර්යයා ඉතා ලාභදායී වූ අතර 1973 සිට මර්ඩොක්ට සිය මෙහෙයුම් එක්සත් ජනපදයට ව්‍යාප්ත කිරීමට හැකි විය.",මර්ඩොක් එක්සත් ජනපදය දක්වා ව්‍යාප්ත වීමට පටන්ගත්තේ කවදාද?,1973
715,9739,ජර්මනිය සමඟ බ්‍රිතාන්‍යය යුද්ධයට ඇති බිය 1914 දී පළමු ලෝක යුද්ධය පුපුරා යාමත් සමඟ අවබෝධ විය. බ්‍රිතාන්‍යය අප්‍රිකාවේ ජර්මනියේ බොහෝ විදේශීය ජනපද ආක්‍රමණය කර අල්ලා ගත්තේය. පැසිෆික් සාගරයේ ඕස්ට්‍රේලියාව සහ නවසීලන්තය පිළිවෙලින් ජර්මානු නිව්ගිනියාව සහ සැමෝවා අල්ලා ගත්හ. ජර්මනියේ පැත්තෙන් යුද්ධයට සම්බන්ධ වූ ඔටෝමාන් අධිරාජ්‍යයේ පශ්චාත්-යුද බෙදීමක් සඳහා වූ සැලසුම් බ්‍රිතාන්‍යය සහ ප්‍රංශය විසින් 1916 සයික්ස්-පිකොට් ගිවිසුම යටතේ රහසිගතව සකස් කරන ලදී. ස්වාධීන අරාබි රාජ්‍යයක් බිහි කිරීමට බ්‍රිතාන්‍යය සහාය දෙන බවට හැඟීමක් ඇති කරමින් බ්‍රිතාන්‍යයන් ඔවුන්ගේ ඔටෝමාන් පාලකයින්ට එරෙහිව අරාබි කැරැල්ලක් දියත් කිරීමට දිරිගැන්වූ මක්කාවේ ෂරීෆ්ට මෙම ගිවිසුම හෙළි නොකළේය. ස්වාධීන අරාබි රාජ්‍යයක් බිහි කිරීමට බ්‍රිතාන්‍යය සහාය දෙන බවට හැඟීමක් ඇති කරමින් බ්‍රිතාන්‍යයන් ඔවුන්ගේ ඔටෝමාන් පාලකයින්ට එරෙහිව අරාබි කැරැල්ලක් දියත් කිරීමට දිරිගැන්වූ මක්කාවේ ෂරීෆ්ට මෙම ගිවිසුම හෙළි නොකළේය.,සැමෝවා පවරා ගත්තේ කවුද?,සයික්ස්-පිකොට් ගිවිසුම
716,9740,"සයික්ස්-පිකොට් ගිවිසුම... මෙම ක්‍රම උපයෝගී කරගනිමින්, ලොස් ඇන්ජලීස් හි උපකල්පිත “සිසිල් ප්‍රජාවන්” වැඩසටහනක් මඟින් ඇමරිකානු ඩොලර් බිලියනයක ඇස්තමේන්තුගත පිරිවැයකින් නාගරික උෂ්ණත්වය දළ වශයෙන් 3 by C කින් අඩු කළ හැකි බවට පුරෝකථනය කර ඇති අතර, වායු සමීකරණ අඩු කිරීමෙන් ඇස්තමේන්තුගත මුළු වාර්ෂික ප්‍රතිලාභ ඇමරිකානු ඩොලර් මිලියන 530 කි. පිරිවැය සහ සෞඛ්‍ය ඉතිරිකිරීම්.",අවට ප්‍රදේශවලට වඩා වැඩි උෂ්ණත්වයක් ඇති අගනගර ප්‍රදේශ මොනවාද?,නාගරික තාප දූපත්
717,9741,"කොමික්ස් යන ඉංග්‍රීසි පදය මාධ්‍යයට යොමු වන විට ඒකීය නාම පදයක් ලෙසද තනි තීරු හෝ විකට පොත් වැනි විශේෂිත අවස්ථා ගැන සඳහන් කිරීමේදී බහු වචන ලෙසද භාවිතා වේ. මෙම යෙදුම ව්‍යුත්පන්න වී ඇත්තේ මුල් ඇමරිකානු පුවත්පත් විකට ලිපි වල ප්‍රමුඛ වූ හාස්‍යජනක (හෝ විකට) කෘතියෙන් වුවද, හාස්‍යජනක නොවන කෘති සඳහා ද එය ප්‍රමිතියක් වී තිබේ. ජපන් කොමික් සඳහා මංගා හෝ ප්‍රංශ භාෂා විකට චිත්‍ර සඳහා ඩෙස්සිනීස් වැනි ජපන් කොමික් සඳහා ඔවුන්ගේ මුල් භාෂාවල භාවිතා වන යෙදුම් අනුව විවිධ සංස්කෘතීන්ගේ විකට චිත්‍ර ඉංග්‍රීසි භාෂාවෙන් සාමාන්‍ය දෙයකි. කොමික් පිළිබඳ අර්ථ දැක්වීමක් සම්බන්ධයෙන් න්‍යායවාදීන් සහ ඉතිහාස ians යින් අතර සම්මුතියක් නොමැත; සමහරු අවධාරණය කරන්නේ රූප හා පෙළ සංයෝජනය, සමහර අනුක්‍රමිකතාව හෝ වෙනත් රූප සම්බන්ධතා, සහ තවත් ඒවා mass තිහාසික අංශ වන මහා ප්‍රතිනිෂ්පාදනය හෝ පුනරාවර්තන අක්ෂර භාවිතය ය. විවිධ විකට සංස්කෘතීන් හා යුගයන්හි සංකල්පවල හරස් පරාගණය වැඩිවීම අර්ථ දැක්වීම තවදුරටත් දුෂ්කර කර ඇත. විවිධ විකට සංස්කෘතීන් හා යුගයන්හි සංකල්පවල හරස් පරාගණය වැඩිවීම අර්ථ දැක්වීම තවදුරටත් දුෂ්කර කර ඇත.",කොමික්ස් යන පදය බහු වචනවලට වඩා ඒකීය ලෙස සලකන්නේ කවදාද?,එය මාධ්‍යයට යොමු වන විට
718,9742,එය මාධ්‍යයට යොමු වන විට එක්සත් ජනපද ආණ්ඩුක‍්‍රම ව්‍යවස්ථාවේ දහවන ව්‍යවස්ථා සංශෝධනය මගින් මෙය නැවත තහවුරු කරන ලද අතර එය ෆෙඩරල් රජයට පවරා නොමැති සියලු බලතල හා අයිතිවාසිකම් ප‍්‍රාන්තවලට සහ ජනතාවට වෙන් කර ඇත.,එක්සත් ජනපදයේ 10 වන සංශෝධනය කුමක්ද?,එය ෆෙඩරල් රජයට පවරා නොමැති සියලුම බලතල සහ අයිතිවාසිකම් ප්‍රාන්තවලට සහ ජනතාවට වෙන් කර ඇත.
719,9743,"සයිප්‍රසය (i / ɪsaɪprəs /; ග්‍රීක: Κύπρος IPA: [ˈcipros]; තුර්කි: Kıbrıs IPA: [ˈkɯbɾɯs]), නිල වශයෙන් සයිප්‍රස් ජනරජය (ග්‍රීක: κήακή ;μοκρατία; තුර්කි: Kıbrıs Cumhuriyeti) යනු නැගෙනහිර දූපතකි. සිරියාවේ සහ තුර්කියේ වෙරළට ඔබ්බෙන් වූ මධ්‍යධරණි මුහුද. [e] සයිප්‍රසය මධ්‍යධරණී මුහුදේ තුන්වන විශාලතම හා තෙවන වැඩිම ජනගහනය සහිත දූපත වන අතර යුරෝපා සංගමයේ සාමාජික රටකි. එය තුර්කියට දකුණින්, සිරියාවට බටහිරින් සහ ලෙබනනය, ඊශ්‍රායලයට වයඹ දෙසින් සහ පලස්තීනය, ඊජිප්තුවට උතුරින් සහ ග්‍රීසියට නැගෙනහිරින් පිහිටා ඇත. එය තුර්කියට දකුණින්, සිරියාවට බටහිරින් සහ ලෙබනනය, ඊශ්‍රායලයට වයඹ දෙසින් සහ පලස්තීනය, ඊජිප්තුවට උතුරින් සහ ග්‍රීසියට නැගෙනහිරින් පිහිටා ඇත.",සයිප්‍රසයට උතුරින් පිහිටි රට කුමක්ද?,කළුකුමා
720,9744,"හැන් ගණිතමය නිබන්ධන තුනක් තවමත් පවතී. ඒවා නම් අංක සහ ගණනය කිරීම පිළිබඳ පොත, ග්නොමොන්ගේ අංක ගණිතය සහ ස්වර්ගයේ චක්‍රලේඛ මාර්ග සහ ගණිත කලාව පිළිබඳ පරිච්ඡේද නවයයි. හැන්-යුගයේ ගණිතමය ජයග්‍රහණ අතරට නිවැරදි කෝණ ත්‍රිකෝණ, වර්ග මූලයන්, කියුබ් මූලයන් සහ අනුකෘති ක්‍රම සමඟ ගැටලු විසඳීම, පයි සඳහා වඩාත් නිවැරදි ඇස්තමේන්තු සොයා ගැනීම, පයිතගරස් ප්‍රමේයයේ ගණිතමය සාක්ෂි සැපයීම, දශම භාගය භාවිතා කිරීම, රේඛීය විසඳීම සඳහා ගවුසියානු තුරන් කිරීම ඇතුළත් වේ. සමීකරණවල මූලයන් සෙවීම සඳහා සමීකරණ සහ අඛණ්ඩ භාග. හැන්-යුගයේ ගණිතමය ජයග්‍රහණ අතරට නිවැරදි කෝණ ත්‍රිකෝණ, වර්ග මූලයන්, කියුබ් මූලයන් සහ අනුකෘති ක්‍රම සමඟ ගැටලු විසඳීම, පයි සඳහා වඩාත් නිවැරදි ඇස්තමේන්තු සොයා ගැනීම, පයිතගරස් ප්‍රමේයයේ ගණිතමය සාක්ෂි සැපයීම, දශම භාගය භාවිතා කිරීම, රේඛීය විසඳීම සඳහා ගවුසියානු තුරන් කිරීම ඇතුළත් වේ. සමීකරණවල මූලයන් සෙවීම සඳහා සමීකරණ සහ අඛණ්ඩ භාග.",අංක සහ ගණනය කිරීම පිළිබඳ පොත සලකනු ලබන්නේ කුමන ආකාරයේ නිබන්ධනයක් ද?,ගණිතමය
721,9745,ගණිතමය ඔකිනාවා 1972 මැයි 15 වන දින ආපසු ලබා දෙන ලද නමුත් එක්සත් ජනපදය ජපානයේ ආරක්ෂාවක් ලෙස දිවයිනේ කඳවුරු වල හමුදා ස්ථානගත කරයි.,ඔකිනාවා අවසානයේ ආපසු පැමිණියේ කවදාද?,1972 මැයි 15
722,9746,1972 මැයි 15 එහි අගනගරය නයිපයිඩව් වන අතර එහි විශාලතම නගරය වන්නේ යාන්ගොන් (රංගූන්) ය.,මියන්මාරයේ විශාලතම ජනගහනය දරණ අගනුවරද?,මියන්මාරයේ විශාලතම ජනගහනය දරණ අගනුවරද?
723,9747,"මුවාවියා තැපැල් සේවය හඳුන්වා දුන් අතර, අබ්දුල්-මලික් එය තම අධිරාජ්‍යය පුරා ව්‍යාප්ත කළ අතර වලීඩ් එය සම්පූර්ණයෙන්ම භාවිතා කළේය. උමයාද් කාලිෆ් අබ්දුල් මලික් නිතිපතා තැපැල් සේවාවක් වර්ධනය කළේය. උමර් බින් අබ්දුල් අසීස් එය තවදුරටත් සංවර්ධනය කළේ කුරාසාන් අධිවේගී මාර්ගය ඔස්සේ අදියරවල තවලම් තැනීමෙනි. කාලිෆ් සහ ඔහුගේ නියෝජිතයන් සහ පළාත්වල ස්ථානගත කර ඇති නිලධාරීන් අතර පිටත් කර යැවීම සඳහා අශ්වයින්ගේ රිලේ භාවිතා කරන ලදී. ප්‍රධාන මහාමාර්ග සැතපුම් 12 ක (කිලෝමීටර 19) අදියරවලට බෙදා ඇති අතර සෑම අදියරකටම අශ්වයන්, බූරුවන් හෝ ඔටුවන් කණුව රැගෙන යාමට සූදානම් විය. මූලික වශයෙන් මෙම සේවාව රජයේ නිලධාරීන්ගේ අවශ්‍යතා සපුරාලන නමුත් සංචාරකයින්ට සහ ඔවුන්ගේ වැදගත් පිටත් කරුවන්ටද පද්ධතියෙන් ප්‍රතිලාභ ලැබුණි. හමුදා ප්‍රවාහනය සඳහා තැපැල් මැදිරි ද භාවිතා කරන ලදී. වරකට මිනිසුන් පනස් සියයක් රැගෙන යාමට ඔවුන්ට හැකි විය. ආණ්ඩුකාර යූසුෆ් බින් උමාර් යටතේ ඉරාකයේ තැපැල් දෙපාර්තමේන්තුවට වසරකට ඩිරාම් 4,000,000 ක් වැය වේ. ආණ්ඩුකාර යූසුෆ් බින් උමාර් යටතේ ඉරාකයේ තැපැල් දෙපාර්තමේන්තුවට වසරකට ඩිරාම් 4,000,000 ක් වැය වේ.","ඩිරාම් වලදී, යූසුෆ් බින් උමර් ආණ්ඩුකාරවරයා ලෙස සිටියදී ඉරාක තැපැල් සේවයේ වාර්ෂික පිරිවැය කොපමණද?","4,000,000 කි"
