,Unnamed: 0,context_translated,question_translated,text_translated,original_index
246,246,"සමහර ස්කොට්ලන්ත හෝ අයර්ලන්ත සමාජ විසින් ප්‍රිමියර් ලීගයට සහභාගී වීම සමහර විට සාකච්ඡා කර ඇති නමුත් ප්‍රති .ල නොමැතිව. මෙම අදහස යථාර්ථයට සමීප වූයේ 1998 දී විම්බල්ඩන්ට අයර්ලන්තයේ ඩබ්ලින් වෙත පදිංචියට යාමට ප්‍රිමියර් ලීග් අනුමැතිය ලැබුණු නමුත් අයර්ලන්ත පාපන්දු සංගමය විසින් එම පියවර අවහිර කරන ලදි. මීට අමතරව, ස්කොට්ලන්තයේ විශාලතම කණ්ඩායම් දෙක වන කෙල්ටික් සහ රේන්ජර්ස් ප්‍රිමියර් ලීග් තරගාවලියට සහභාගී විය යුතුද නැද්ද යන අදහස මාධ්‍ය විසින් ඉඳහිට සාකච්ඡා කරයි, නමුත් මෙම සාකච්ඡාවලින් කිසිවක් පැමිණ නැත. මීට අමතරව, ස්කොට්ලන්තයේ විශාලතම කණ්ඩායම් දෙක වන කෙල්ටික් සහ රේන්ජර්ස් ප්‍රිමියර් ලීග් තරගාවලියට සහභාගී විය යුතුද නැද්ද යන අදහස මාධ්‍ය විසින් ඉඳහිට සාකච්ඡා කරයි, නමුත් මෙම සාකච්ඡාවලින් කිසිවක් පැමිණ නැත.",ප්‍රිමියර් ලීග් තරගාවලියේ ස්කොට්ලන්තය හෝ අයර්ලන්තය සමාජ ශාලා තිබේද?,සමහර ස්කොට්ලන්ත හෝ අයර්ලන්ත සමාජ විසින් ප්‍රිමියර් ලීගයට සහභාගී වීම සමහර විට සාකච්ඡා කර ඇති නමුත් ප්‍රති .ල නොමැතිව.,1246
247,247," 2011 සංගණනයෙන්, ජාතික සංඛ්‍යාලේඛන කාර්යාලය ප්‍රකාශයට පත් කළේ ප්ලයිමූත් හි ඒකීය අධිකාරියේ ජනගහනය 256,384 ක් බවය; ප්ලයිමවුට් හි ජනගහනය 240,720 ක් බව 2001 සිට අවසන් වරට කරන ලද සංගණනයට වඩා 15,664 ක් වැඩි පිරිසක්. 2011 දී ප්ලිමුත් නාගරික ප්‍රදේශයේ ජනගහනය 260,203 ක් විය (අධිකාරියේ සීමාවෙන් ඔබ්බට විහිදෙන නාගරික ව්‍යාප්තිය). නගරයේ සාමාන්‍ය කුටුම්භ ප්‍රමාණය පුද්ගලයන් 2.3 කි. 2011 එක්සත් රාජධානියේ සංගණනය කරන විට ප්ලයිමවුත් හි ජනගහනයේ ජනවාර්ගික සංයුතිය සුදු ජාතිකයින් 96.2% ක් විය (92.9% ක් සුදු බ්‍රිතාන්‍යයන් විය), විශාලතම සුළු ජනවාර්ගික කණ්ඩායම 0.5% ක් චීන ජාතිකයන් විය. සුදු අයර්ලන්ත ජනවාර්ගික කණ්ඩායම 2001 සංගණනයෙන් පසු (-24%) ජනගහනයේ විශාලතම අඩුවීමක් පෙන්නුම් කළ අතර අනෙක් ආසියානු සහ කළු අප්‍රිකානුවන් විශාලතම වැඩිවීම් (පිළිවෙලින් 360% සහ 351%) ලබා ගත්හ. 2011 ජිප්සී හෝ අයර්ලන්ත සංචාරක හා අරාබි සංගණනයට එකතු කරන ලද නව ජනවාර්ගික කණ්ඩායම් දෙක මෙයින් බැහැර කරයි. 19 වන සියවසේ දෙවන භාගයේදී ජනගහනය වේගයෙන් ඉහළ ගිය නමුත් 1931 සිට 1951 දක්වා 1.6% කින් අඩු විය. 19 වන සියවසේ දෙවන භාගයේදී ජනගහනය වේගයෙන් ඉහළ ගිය නමුත් 1931 සිට 1951 දක්වා 1.6% කින් අඩු විය.",2011 දී ප්ලයිමවුට් පදිංචිකරුවන්ගෙන් චීන පරම්පරාවෙන් පැමිණි ප්‍රතිශතය කුමක්ද?,0.5,1247
248,248,"ග්‍රෑන්ඩ් ලොජ් අතර සම්බන්ධතා තීරණය වන්නේ පිළිගැනීමේ සංකල්පයෙනි. සෑම ග්‍රෑන්ඩ් ලොජ් එකක්ම එය හඳුනාගන්නා වෙනත් ග්‍රෑන්ඩ් ලොජ් ලැයිස්තුවක් පවත්වාගෙන යයි. ග්‍රෑන්ඩ් ලොජ් දෙකක් හඳුනාගෙන එකිනෙකා සමඟ මැසොනික් සන්නිවේදනයේ යෙදී සිටින විට, ඔවුන් සුහදව සිටින බව කියනු ලබන අතර, එකිනෙකාගේ සහෝදරයන් එකිනෙකාගේ ලැගුම්හල් වෙත ගොස් පෙදරේරු ලෙස මැදිහත් විය හැකිය. ග්‍රෑන්ඩ් ලැජ්ජාවන් දෙකක් සුහදව නොසිටින විට, අන්තර් සංචාරය කිරීමට අවසර නැත. එක් ග්‍රෑන්ඩ් ලොජ් එකක් අනෙකාගේ පිළිගැනීම අත්හිටුවීමට හෝ ඉවත් කර ගැනීමට හේතු බොහෝමයක් ඇත, නමුත් වඩාත් සුලභ වන්නේ විශේෂ අධිකරණ බලය සහ නිත්‍යභාවයයි. එක් ග්‍රෑන්ඩ් ලොජ් එකක් අනෙකාගේ පිළිගැනීම අත්හිටුවීමට හෝ ඉවත් කර ගැනීමට හේතු බොහෝමයක් ඇත, නමුත් වඩාත් සුලභ වන්නේ විශේෂ අධිකරණ බලය සහ නිත්‍යභාවයයි.",එක් එක් ග්‍රෑන්ඩ් ලොජ් නඩත්තු කරන්නේ කුමක් ද?,ලැයිස්තුවක්,1248
249,249,"Compass-M1 යනු 2007 අප්‍රියෙල් 14 වන දින සං signal ා පරීක්ෂාව සහ වලංගු කිරීම සහ සංඛ්‍යාත ගොනු කිරීම සඳහා දියත් කරන ලද පර්යේෂණාත්මක චන්ද්‍රිකාවකි. මාලිමා යන්ත්‍රය සඳහා Compass-M1 හි කාර්යභාරය ගැලීලියෝ පද්ධතිය සඳහා වන GIOVE චන්ද්‍රිකා වල භූමිකාවට සමානය. මාලිමා-එම් 1 කක්ෂය ආසන්න වශයෙන් වටකුරු වන අතර උන්නතාංශය කිලෝමීටර් 21,150 ක් වන අතර අංශක 55.5 ක නැඹුරුවක් ඇත. මාලිමා-එම් 1 කක්ෂය ආසන්න වශයෙන් වටකුරු වන අතර උන්නතාංශය කිලෝමීටර් 21,150 ක් වන අතර අංශක 55.5 ක නැඹුරුවක් ඇත.",මාලිමා-එම් 1 චන්ද්‍රිකාවේ අරමුණ වෙනත් චන්ද්‍රිකා වල අරමුණට සමානද?,ගැලීලියෝ පද්ධතිය සඳහා වන GIOVE චන්ද්‍රිකා,1249
250,250,"Chromobacterium violaceum සහ Pseudomonas fluorescens යන දෙකම සයනයිඩ් සංයෝගයක් ලෙස solid න තඹ බලමුලු ගැන්විය හැකිය. කැලූනා, එරිකා සහ වැකිනියම් සමඟ සම්බන්ධ වූ එරිකොයිඩ් මයිකොරයිසල් දිලීර තඹ ලෝහමය පසෙහි වර්ධනය විය හැකිය. සුයිලස් ලුටියුස් යන ectomycorrhizal දිලීර තරුණ පයින් ගස් තඹ විෂ වලින් ආරක්ෂා කරයි. ඇස්පර්ගිලස් නයිගර් දිලීරයේ නියැදියක් රන් කැණීම් ද්‍රාවණයෙන් වර්ධනය වන බව සොයා ගන්නා ලදී. සයනෝ ලෝහ සංකීර්ණ අඩංගු බව සොයා ගන්නා ලදී; රන්, රිදී, තඹ යකඩ සහ සින්ක් වැනි. බැර ලෝහ සල්ෆයිඩ ද්‍රාව්‍යකරණය කිරීමේදී දිලීර ද භූමිකාවක් ඉටු කරයි. බැර ලෝහ සල්ෆයිඩ ද්‍රාව්‍යකරණය කිරීමේදී දිලීර ද භූමිකාවක් ඉටු කරයි.",බැර ලෝහ සල්ෆයිඩ් මෘදු කිරීමට උපකාරී වන දිලීර මොනවාද?,ඇස්පර්ගිලස් දිලීර,1250
251,251,"මුලදී සංවේදක යනු පළමුවන ලෝක සංග්‍රාමයේදී සංවර්ධනය කරන ලද සහ 1930 දශකය දක්වාම අඛණ්ඩව පැවතුන නමුත් රේඩාර් මගින් ඉක්මණින් අභිබවා යන අතර 1980 දශකයේ දී ඔප්ට්‍රොනික් මගින් අතිරේකව සපයන ලදී. 1930 ගණන්වල අග භාගය වන තෙක් බ්‍රිතාන්‍යය ඒඩීජීබී සඳහා ඒකාබද්ධ පද්ධතියක් නිර්මාණය කරන තෙක් හමුදාවේ ඒඒ කමාන්ඩ් හි භූමි පාදක ගුවන් ආරක්ෂාව සම්බන්ධ කරන ලදී. නේටෝව පසුව මෙම විධිවිධාන ""ගුවන් ආරක්ෂක භූමි පරිසරයක්"" ලෙස හැඳින්වූ අතර එය අර්ථ දැක්වුනේ ""ගුවන් ආරක්ෂක මෙහෙයුම් උපායශීලීව පාලනය කිරීම සඳහා භාවිතා කරන නිශ්චිත මෙහෙයුම් රඟහලක් තුළ භූගත රේඩාර් අඩවි සහ අණ හා පාලන මධ්‍යස්ථාන ජාලය"" ලෙසිනි. නේටෝව පසුව මෙම විධිවිධාන ""ගුවන් ආරක්ෂක භූමි පරිසරයක්"" ලෙස හැඳින්වූ අතර එය අර්ථ දැක්වුනේ ""ගුවන් ආරක්ෂක මෙහෙයුම් උපායශීලීව පාලනය කිරීම සඳහා භාවිතා කරන නිශ්චිත මෙහෙයුම් රඟහලක් තුළ භූගත රේඩාර් අඩවි සහ අණ හා පාලන මධ්‍යස්ථාන ජාලය"" ලෙසිනි.",මෙම විධිවිධාන ගුවන් ආරක්ෂක භූමි පරිසරයක් බව ප්‍රකාශ කළ ආයතනය කුමක්ද?,නේටෝ,1251
252,252,නේටෝ : 115–147,"විවිධත්වය ප්‍රවර්ධනය කිරීමට පිටතින්, සහතික කිරීමේ ක්‍රියාමාර්ගයට පක්ෂව සිටීමට අනෙක් හේතුව ඊස්ට්ලන්ඩ් විශ්වාස කළේද?",අතීත වෙනස්කම්වලට පිළියම් යෙදීම,1252
253,253,අතීත වෙනස්කම්වලට පිළියම් යෙදීම මෙතැන් සිට සුමේරියානු භාෂාව පවතින්නේ මධ්‍යකාලීන යුරෝපයේ ලතින් භාෂාව දැරූ තනතුරට සමාන සාහිත්‍ය හා පූජනීය භාෂාවක් පමණි.,සුමේරියානු ඉඩම්වල කෘෂිකාර්මික tivity ලදායිතාවයට ලවණතාව ඉහළ යාමේ බලපෑම කුමක්ද?,සම්මුතියකට,1253
254,254,"වයඹ යනු විශාල නේවාසික පර්යේෂණ විශ්ව විද්‍යාලයකි. රසායන විද්‍යාව, මනෝවිද්‍යාව, ව්‍යාපාර, අධ්‍යාපනය, පුවත්පත් කලාව, සංගීතය, ඉංජිනේරු විද්‍යාව, නීතිය සහ වෛද්‍ය විද්‍යාව සඳහා උතුරු මධ්‍යම විද්‍යාල හා පාසල්වල ජාතික වෘත්තීය සංවිධාන විසින් ප්‍රතීතනය ලබා ඇති මෙම විශ්ව විද්‍යාලය උපාධි අපේක්ෂක වැඩසටහන් 124 ක් සහ උපාධි හා වෘත්තීය වැඩසටහන් 145 ක් ඉදිරිපත් කරයි. වයඹදිග 2012–2013 කාලය තුළ උපාධි 2,190 ක්, ශාස්ත්‍රපති උපාධි 3,272 ක්, ආචාර්ය උපාධි 565 ක් සහ වෘත්තීය උපාධි 444 ක් ප්‍රදානය කර ඇත. වයඹදිග 2012–2013 කාලය තුළ උපාධි 2,190 ක්, ශාස්ත්‍රපති උපාධි 3,272 ක්, ආචාර්ය උපාධි 565 ක් සහ වෘත්තීය උපාධි 444 ක් ප්‍රදානය කර ඇත.",2012-2013 පාසල් කාලය තුළ වයඹ දිග උපාධි කීයක් ලබා දී තිබේද?,"2,190 කි",1254
255,255,"සම්භාව්‍ය සංගීත ians යන් බැරොක් යුගයේ සිට සෙලෝ, කොන්ට්‍රාබාස්, රෙකෝඩරය, ට්‍රම්බෝන්, ටිම්පානි, ෆෝටෙපියානෝ සහ ඉන්ද්‍රිය වැනි බොහෝ උපකරණ භාවිතා කළහ. සමහර බැරොක් උපකරණ භාවිතයට නොගත් අතර (උදා: තියර්බෝ සහ ජාවාරම), බොහෝ බැරොක් උපකරණ අදටත් භාවිතයේ පවතින අනුවාද වලට වෙනස් කර ඇත, එනම් බැරොක් වයලීනය (වයලීනය බවට පත් විය), බැරොක් ඕබෝ (එය බවට පත් විය oboe) සහ බැරොක් හොරණෑව, එය සාමාන්‍ය කපාට හොරණෑවට සංක්‍රමණය විය. සමහර බැරොක් උපකරණ භාවිතයට නොගත් අතර (උදා: තියර්බෝ සහ ජාවාරම), බොහෝ බැරොක් උපකරණ අදටත් භාවිතයේ පවතින අනුවාද වලට වෙනස් කර ඇත, එනම් බැරොක් වයලීනය (වයලීනය බවට පත් විය), බැරොක් ඕබෝ (එය බවට පත් විය oboe) සහ බැරොක් හොරණෑව, එය සාමාන්‍ය කපාට හොරණෑවට සංක්‍රමණය විය.",තියර්බෝ සහ වෙනත් බැරොක් මෙවලම භාවිතයට නොගියේද?,රාකට්,1255
256,256,"ෆ්‍රැන්කෝ-ප්‍රෂියානු යුද්ධය හෝ ෆ්‍රැන්කෝ-ජර්මානු යුද්ධය (ජර්මානු: ඩොයිෂ්-ෆ්‍රැන්සිස්චර් ක්‍රිග්, ආලෝකමත් විය. ජර්මානු-ප්‍රංශ යුද්ධය, ප්‍රංශ: ගුවර් ෆ්‍රැන්කෝ-ඇලමන්ඩ්, ලයිට්. ෆ්‍රැන්කෝ-ජර්මානු යුද්ධය) (1870 ජූලි 19 - 1871 මැයි 10), දෙවන ප්‍රංශ අධිරාජ්‍යය සහ ප්‍රෂියා රාජධානිය විසින් මෙහෙයවන ලද උතුරු ජර්මානු සම්මේලනයේ ජර්මානු රාජ්‍යයන් අතර ගැටුමකි. ජර්මානු එක්සත් කිරීම දීර් extend කිරීමේ ප්‍රෂියානු අභිලාෂයන් නිසා ගැටුම ඇති විය. සමහර ඉතිහාස ians යින් තර්ක කරන්නේ ප්‍රෂියානු චාන්සලර් ඔටෝ වොන් බිස්මාර්ක් දකුණු ජර්මානු රාජ්‍යයන් වන බේඩන්, වර්ටම්බර්ග්, බැවේරියා සහ හෙස්සි-ඩාර්ම්ස්ටැඩ් යන රටවල් ප්‍රංශ ප්‍රහාරයක් අවුලුවාලීමට සැලසුම් කර ඇති බවයි. බිස්මාර්ක් කිසිවක් සැලසුම් නොකළ බවත්, ඒවා දිග හැරෙන විට තත්වයන් ගසාකන බවත්. සමහර ඉතිහාස ians යින් තර්ක කරන්නේ ප්‍රෂියානු චාන්සලර් ඔටෝ වොන් බිස්මාර්ක් දකුණු ජර්මානු රාජ්‍යයන් වන බේඩන්, වර්ටම්බර්ග්, බැවේරියා සහ හෙස්සි-ඩාර්ම්ස්ටැඩ් යන රටවල් ප්‍රංශ ප්‍රහාරයක් අවුලුවාලීමට සැලසුම් කර ඇති බවයි. බිස්මාර්ක් කිසිවක් සැලසුම් නොකළ බවත්, ඒවා දිග හැරෙන විට තත්වයන් ගසාකන බවත්.",ගැටුමට හේතු වූ කාගේ අභිලාෂයන්ද?,ප්‍රෂියානු අභිලාෂයන්,1256
257,257,"ප්‍රෂියානු අභිලාෂයන්... මුල් ගෘහ නිර්මාණ ශිල්පයේ ඉතිරිව ඇත්තේ කැබලි පමණි, විශේෂයෙන් සංකීර්ණ වාස්තු විද්‍යාත්මක මන as කල්පිතයන් ඉදිරිපිට සාන්තුවරයන් දෑත් ඔසවා යාච් prayer ාවෙන් නිරූපණය කරන සංගීත කණ්ඩායමකි.",සැන්ටා කොස්ටැන්සා පල්ලියේ මුල් කාර්යය කුමක්ද?,සොහොන් ගෙයක්,1257
258,258,"ග්‍රීසිය උපායමාර්ගිකව යුරෝපයේ, ආසියාවේ සහ අප්‍රිකාවේ සන්ධිස්ථානයක පිහිටා ඇත. බෝල්කන් අර්ධද්වීපයේ දකුණු කෙළවරේ පිහිටා ඇති එය වයඹ දෙසින් ඇල්බේනියාව, උතුරින් මැසිඩෝනියාව සහ බල්ගේරියාව සහ තුර්කිය ඊසාන දෙසින් ඉඩම් මායිම් බෙදා ගනී. ග්‍රීසිය භූගෝලීය කලාප නවයකින් සමන්විත වේ: මැසිඩෝනියාව, මධ්‍යම ග්‍රීසිය, පෙලෝපොනිස්, තෙසාලි, එපිරස්, ඒජියන් දූපත් (ඩොඩෙකනීස් සහ සයික්ලේඩ්ස් ඇතුළුව), ත්‍රේස්, ක්‍රීට් සහ අයෝනියන් දූපත්. ඒජියන් මුහුද පිහිටා ඇත්තේ ප්‍රධාන භූමියට නැගෙනහිරින්, බටහිරින් අයෝනියන් මුහුද සහ දකුණින් මධ්‍යධරණි මුහුදයි. ග්‍රීසිය මධ්‍යධරණී ද්‍රෝණියේ දිගම වෙරළ තීරය වන අතර ලෝකයේ 11 වන දිගම වෙරළ තීරය කිලෝමීටර් 13,676 (සැතපුම් 8,498) ක් වන අතර එහි දූපත් විශාල ප්‍රමාණයක් අඩංගු වන අතර ඉන් 227 ක් ජනාවාස වී ඇත. ග්‍රීසියෙන් සියයට අසූවක් කඳුකරය, ඔලිම්පස් කන්ද මීටර් 2,918 (අඩි 9,573) ක උසම කඳු මුදුන වේ. ග්‍රීසියෙන් සියයට අසූවක් කඳුකරය, ඔලිම්පස් කන්ද මීටර් 2,918 (අඩි 9,573) ක උසම කඳු මුදුන වේ.",ග්‍රීසිය සෑදී ඇත්තේ භූගෝලීය කලාප කීයක් ද?,නවය,1258
