,Unnamed: 0,context_translated,question_translated,text_translated,original_index
725,725,"ස්කයිගේ උපායමාර්ගය, ප්‍රිමියර් ලීග් පාපන්දු වල ගුණාත්මකභාවය සහ ක්‍රීඩාව සඳහා මහජනතාවගේ රුචිය... පෙබරවාරි 23 වන දින, 28 වන නාවික රෙජිමේන්තුව සූරිබාචි කඳු මුදුනට ළඟා වූ අතර, දැන් ප්‍රසිද්ධ අයිවෝ ජීමා පින්තූරය මත ධජය එසවීම සඳහා පොළඹවයි. ධජය දුටු නාවික හමුදා ලේකම් ජේම්ස් ෆොරෙස්ටල්, “ඉදිරි වසර 500 සඳහා මැරීන් බළකායක් සිටිනු ඇත.” ධජය එසවීම බොහෝ විට වඩාත්ම ප්‍රතිනිෂ්පාදනය කරන ලද ඡායාරූපයක් ලෙස සඳහන් කර ඇති අතර එම සටනේ පමණක් නොව සමස්ත පැසිෆික් යුද්ධයේම පුරාවිද්‍යාත්මක නිරූපණය බවට පත්විය. පෙබරවාරි මාසයේ ඉතිරි කාලය සඳහා ඇමරිකානුවන් උතුරට තල්ලු වූ අතර මාර්තු 1 වන විට දිවයිනෙන් තුනෙන් දෙකක් අල්ලාගෙන තිබුණි. නමුත් මාර්තු 26 වනදා තෙක් දිවයින සුරක්ෂිත විය. ජපන් ජාතිකයන් අන්තිම මිනිසා දක්වා සටන් කළ අතර මැරීන් භටයින් 6,800 ක් and ාතනය කළ අතර තවත් 20,000 කට ආසන්න පිරිසක් තුවාල ලැබූහ. ජපාන පාඩු වලින් පිරිමින් 20,000 කට වඩා මිය ගොස් ඇති අතර සිරකරුවන් 1,083 ක් පමණක් ගෙන ඇත. ඉතිහාස ians යින් විවාද කරන්නේ එය සිදුවූ හානි උපායමාර්ගිකව වටිනවාද යන්නයි.",අයිවෝ ජීමා හි ජපන් සිරකරුවන් කී දෙනෙකු රැගෙන ගොස් තිබේද?,අයිවෝ ජීමා හි ජපන් සිරකරුවන් කී දෙනෙකු රැගෙන ගොස් තිබේද?,1725
726,726,අනෙකුත් ක්‍රීඩා සමාජ අතර ප්ලයිමූත් ඇල්බියන් ආර්.එෆ්.සී. සහ ප්ලිමුත් රයිඩර්ස් පැසිපන්දු සමාජය. ප්ලයිමූත් ඇල්බියන් රග්බි පාපන්දු සමාජය යනු 1875 දී ආරම්භ කරන ලද රග්බි සංගම් සමාජයක් වන අතර මේ වන විට වෘත්තීය ඉංග්‍රීසි රග්බි ක්‍රීඩාවේ තුන්වන පෙළට තරඟ වදිති. ඔවුන් ගඩොල් පිටියේ ක්‍රීඩා කරයි. ප්ලයිමූත් රයිඩර්ස් බ්‍රිතාන්‍ය පැසිපන්දු ලීගයේ ක්‍රීඩා කරයි - බ්‍රිතාන්‍ය පැසිපන්දු ක්‍රීඩාවේ ඉහළම පෙළ. ඔවුන් ප්ලයිමවුට් මණ්ඩපයේ විනෝදාස්වාද ක්‍ෂේත්‍රයේ ක්‍රීඩා කරන අතර එය 1983 දී ආරම්භ කරන ලද්දකි. ප්ලයිමූත් ක්‍රිකට් සමාජය 1843 දී පිහිටුවන ලදී. ප්ලයිමූත් ඩෙවිල්ස් යනු බ්‍රිතාන්‍ය ප්‍රිමියර් ලීගයේ වේගවත් මාවතකි. ප්ලයිමූත් 2010 වන තෙක් ඇමරිකානු පාපන්දු සමාජයක් වන ප්ලයිමූත් අද්මිරාල්වරුන්ගේ නිවහන විය. ප්ලයිමූත් ප්ලයිමූත් මාජන්ස් හොකී සමාජයේ නිවහන වන අතර ඔවුන්ගේ පළමු XI කණ්ඩායම පසුගිය කන්නයේ ජාතික ලීගයට ක්‍රීඩා කළේය.,ප්ලයිමුත් නිවස ලෙස හඳුන්වන බ්‍රිතාන්‍ය පැසිපන්දු ලීග් කණ්ඩායම කුමක්ද?,ප්ලිමුත් රයිඩර්ස්,1726
727,727,"කෝපිහවුස් නියෝජනය කරන්නේ ඉතිහාසයේ සන්ධිස්ථානයක් වන අතර ඔවුන්ගේ ප්‍රජාවන් තුළ විනෝදජනක සමාජ ජීවිතයක් ගත කළ හැකි බව මිනිසුන් විසින් සොයා ගන්නා ලදී. පළමු වතාවට තම අසල්වැසියන් සමඟ කතිකාවෙහි යෙදීමටත්, කුතුහලය දනවන හා සිතුවිලි ජනිත කරවන කාරණා ගැනත්, විශේෂයෙන් දේශපාලනයට දර්ශනය පිළිබඳ කරුණු සාකච්ඡා කිරීමටත් උත්සාහ කළ බොහෝ දෙනෙකුට කෝපි ෂොප්ස් නිවසින් බැහැර නිවාස බවට පත්විය. ප්‍රබුද්ධත්වයට කෝපිහවුස් අත්‍යවශ්‍ය විය, මන්ද ඒවා නිදහස් චින්තනයේ සහ ස්වයං සොයාගැනීමේ මධ්‍යස්ථාන විය. බොහෝ කෝපිහවුස් අනුග්‍රාහකයන් විද්වතුන් වුවද, විශාල ප්‍රමාණයක් එසේ නොවීය. කෝපිහවුස් උගත් ධනවතුන් පමණක් නොව ධනේශ්වරයේ සාමාජිකයින් සහ පහළ පංතිය ඇතුළු විවිධ පුද්ගලයින් ආකර්ෂණය කර ගත්හ. වෛද්‍යවරුන්, නීති yers යින්, වෙළෙන්දන් යනාදී අනුග්‍රාහකයන් සෑම පංතියක්ම පාහේ නියෝජනය කිරීම ධනාත්මක බවක් පෙනෙන්නට තිබුණද, පංති වෙනස ආරක්ෂා කර ගැනීමට උත්සාහ කරන අය තුළ කෝපි ෂොප් පරිසරය භීතියක් ඇති කළේය. කෝපිහවුස් හි වඩාත් ජනප්‍රිය විවේචන වලින් එකක් කියා සිටියේ එය “සමාජ ඉණිමඟේ විවිධ තරාතිරම්වල සිටින, ශිල්පියාගේ සිට වංශාධිපතියා දක්වා මිනිසුන් අතර අනියම් ඇසුරක් පැවැත්වීමට ඉඩ දී ඇති” බවත් එබැවින් නෝවාගේ නැව සමඟ සංසන්දනය කර සියලු වර්ගවල සතුන් පිරිසිදු, අපිරිසිදු බවත්ය. . ජෝසෆ් ඇඩිසන් සහ රිචඩ් ස්ටීල් ප්‍රේක්ෂකයන් ලෙස එහි විභවය හඳුනාගත් විට මෙම අද්විතීය සංස්කෘතිය පුවත්පත් කලාවේ උත්ප්‍රේරකයක් ලෙස සේවය කළේය. ස්ටීල් සහ ඇඩිසන් එක්ව දිනපතා ප්‍රකාශනයක් වන ද ස්පෙක්ටේටර් (1711) ප්‍රකාශයට පත් කළ අතර එය ප්‍රබන්ධ කථික ස්පෙක්ටේටර් මහතා හරහා බැරෑරුම් දාර්ශනික කරුණු පිළිබඳ විනෝදාස්වාදය හා සාකච්ඡාව ඇති කිරීම අරමුණු කර ගත්හ. ස්ටීල් සහ ඇඩිසන් එක්ව දිනපතා ප්‍රකාශනයක් වන ද ස්පෙක්ටේටර් (1711) ප්‍රකාශයට පත් කළ අතර එය ප්‍රබන්ධ කථික ස්පෙක්ටේටර් මහතා හරහා බැරෑරුම් දාර්ශනික කරුණු පිළිබඳ විනෝදාස්වාදය හා සාකච්ඡාව ඇති කිරීම අරමුණු කර ගත්හ.",තම ප්‍රජාවන් තුළ විනෝදජනක සමාජ ජීවිතයක් ගත කළ හැකි බව මිනිසුන් සොයාගත් ඉතිහාසයේ හැරවුම් ලක්ෂ්‍යයක් නියෝජනය කරන්නේ කුමන ස්ථානයද?,කෝපිහවුස්,1727
728,728,"ඩාවින් වෛද්‍ය විද්‍යාව හැදෑරීම සඳහා 1825 දී එඩින්බරෝ විශ්ව විද්‍යාලයට ගියේය. ඔහුගේ දෙවන වසර තුළ ස්වාභාවික ඉතිහාසය පිළිබඳ ඔහුගේ වෛද්‍ය අධ්‍යයන නොසලකා හැර ඇති අතර සමුද්‍ර අපෘෂ් b වංශීන් පිළිබඳ රොබට් ග්‍රාන්ට්ගේ පර්යේෂණ සඳහා මාස හතරක් ගත කළේය. විශේෂ සම්ප්‍රේෂණය සඳහා ග්‍රාන්ට් සිය උනන්දුව හෙළි කළ නමුත් ඩාවින් එය ප්‍රතික්ෂේප කළේය. 1827 සිට කේම්බ්‍රිජ් විශ්ව විද්‍යාලයෙන් ඩාවින් උද්භිද විද්‍යා John ජෝන් ස්ටීවන්ස් හෙන්ස්ලෝ වෙතින් ස්වාභාවික දේවධර්මය ලෙස විද්‍යාව ඉගෙන ගත් අතර පැලේ, ජෝන් හර්ෂල් සහ ඇලෙක්සැන්ඩර් වොන් හුම්බෝල්ට් කියවීය. විද්‍යාව පිළිබඳ උද්‍යෝගයෙන් පිරුණු ඔහු ඇඩම් සෙඩ්ග්වික් සමඟ ව්‍යසනකාරී භූ විද්‍යාව හැදෑරීය. විද්‍යාව පිළිබඳ උද්‍යෝගයෙන් පිරුණු ඔහු ඇඩම් සෙඩ්ග්වික් සමඟ ව්‍යසනකාරී භූ විද්‍යාව හැදෑරීය.",සමුද්‍ර අපෘෂ් b වංශීන් පිළිබඳ පර්යේෂණ කිරීමට ඩාවින් සහාය වූයේ කවුද?,රොබට් ග්‍රාන්ට්,1728
729,729,"සවුත් බ්‍රොන්ක්ස් හි මෑත වසරවලදී කඩ සහ දාම හෝටල් කිහිපයක් විවෘත කර ඇත; මීට අමතරව, මොට් හෙවන් ජලාශය සඳහා යෝජනා කර ඇති ලා ක්වින්ටා තානායම. ලෝකයේ විශාලතම අවි ගබඩාව ලෙස බොහෝ විට සඳහන් වන කිංස්බ්‍රිජ් අවි ගබඩාව කිංස්බ්‍රිජ් ජාතික අයිස් මධ්‍යස්ථානය ලෙස නැවත සංවර්ධනය කිරීමට සැලසුම් කර ඇත. අනාගත සංවර්ධනය සඳහා සලකා බලනු ලබන්නේ ලෙමන් විද්‍යාලයට යාබදව නිව්යෝර්ක් නගරයේ උමං මාර්ග කොන්කෝස් අංගනය හරහා වේදිකාවක් ඉදිකිරීමයි. මෙම ඉදිකිරීම සඳහා වර්ග අඩි 2,000,000 (190,000 m2) පමණ සංවර්ධනය කිරීමට ඉඩ ලබා දෙන අතර ඇමරිකානු ඩොලර් මිලියන 350-500 අතර මුදලක් වැය වේ. මෙම ඉදිකිරීම සඳහා වර්ග අඩි 2,000,000 (190,000 m2) පමණ සංවර්ධනය කිරීමට ඉඩ ලබා දෙන අතර ඇමරිකානු ඩොලර් මිලියන 350-500 අතර මුදලක් වැය වේ.",ලෝකයේ විශාලතම අවි ගබඩාව කුමක්ද?,කිංස්බ්‍රිජ් ආමරි,1729
730,730,"පළමුවන ලෝක සංග්‍රාමයට හේතු සාධක අතරට යුද්ධයට පෙර දශක හතරක ගැටුම් හා ප්‍රතිවිරෝධතා ඇතුළත් විය. 1907 දී ඇන්ග්ලෝ-රුසියානු එන්ටෙන්ටේ අත්සන් කිරීමෙන් පසු එක්සත් රාජධානිය, ප්‍රංශය සහ රුසියාව අතර ලිහිල් පෙලගැස්මට ලබා දුන් නම ත්‍රිත්ව එන්ටෙන්ටේ ය. ජපානය, එක්සත් ජනපදය සමඟ විවිධ ගිවිසුම් මගින් අතිරේකව බලතල තුන පෙළගැස්වීම. ස්පා Spain ්, ය, ජර්මනිය, ඔස්ට්‍රියාව-හංගේරියාව සහ ඉතාලියේ ත්‍රිත්ව සන්ධානයට ප්‍රබල ප්‍රතිවිරුද්ධ බරක් පිහිටුවා ගත් අතර, තෙවැන්නා ප්‍රංශය සමඟ අතිරේක රහස් ගිවිසුමක් අවසන් කර ඇගේ සන්ධාන බැඳීම් effectively ලදායී ලෙස අහෝසි කළේය. මිලිටරිවාදය, සන්ධාන, අධිරාජ්‍යවාදය සහ ජාතිකවාදය ගැටුමේ ප්‍රධාන භූමිකාවන් ඉටු කළේය. යුද්ධයේ ආසන්නතම මූලාරම්භය වූයේ 1914 ජූලි අර්බුදයේදී රාජ්‍ය තාන්ත්‍රිකයින් සහ ජෙනරාල්වරුන් විසින් ගනු ලැබූ තීරණ, ඔස්ට්‍රියාවේ අගරදගුරු ෆ්‍රාන්ස් ෆර්ඩිනන්ඩ් of ාතනය කිරීම සඳහා වූ ගිනි පුපුර (හෝ කැසුස් බෙලි) ය. යුද්ධයේ ආසන්නතම මූලාරම්භය වූයේ 1914 ජූලි අර්බුදයේදී රාජ්‍ය තාන්ත්‍රිකයින් සහ ජෙනරාල්වරුන් විසින් ගනු ලැබූ තීරණ, ඔස්ට්‍රියාවේ අගරදගුරු ෆ්‍රාන්ස් ෆර්ඩිනන්ඩ් of ාතනය කිරීම සඳහා වූ ගිනි පුපුර (හෝ කැසුස් බෙලි) ය.",යුද්ධයේ ආරම්භය කුමක්ද?,1914 ජූලි අර්බුදය අතරතුර රාජ්‍ය නායකයින් සහ ජෙනරාල්වරුන් විසින් ගනු ලැබූ තීරණ,1730
731,731,"බොහෝ සෝපානවල ගොඩනැගිලි හිමිකරුට සෝපානය ක්‍රියාත්මක කිරීමට අවසර පත්‍රය පෙන්වන ස්ථානයක් ඇත. සමහර අධිකරණ බලයන්ට විදුලි සෝපාන කැබ් රථයේ අවසර පත්‍රය ප්‍රදර්ශනය කිරීමට අවශ්‍ය වන අතර, වෙනත් අධිකරණ බලතල මඟින් මෙහෙයුම් බලපත්‍රය නඩත්තු කාර්යාලය වැනි වෙනත් තැනක ලිපිගොනු වල තබා ගැනීමට ඉඩ සලසයි. එවැනි අවස්ථාවන්හිදී සෝපාන කැබ් රථයේ බලපත්‍රය ප්‍රදර්ශනය කිරීම වෙනුවට බොහෝ විට දැනුම් දීමක් එහි ස්ථානගත කර ඇති අතර සැබෑ බලපත්‍ර තබා ඇති ස්ථානය පිළිබඳව යතුරුපැදි කරුවන්ට දැනුම් දෙනු ලැබේ. එවැනි අවස්ථාවන්හිදී සෝපාන කැබ් රථයේ බලපත්‍රය ප්‍රදර්ශනය කිරීම වෙනුවට බොහෝ විට දැනුම් දීමක් එහි ස්ථානගත කර ඇති අතර සැබෑ බලපත්‍ර තබා ඇති ස්ථානය පිළිබඳව යතුරුපැදි කරුවන්ට දැනුම් දෙනු ලැබේ.",සියලුම අධිකරණ බලය සෝපානයේ ප්‍රදර්ශනය කිරීමට අවසර අවශ්‍යද?,"සමහර අධිකරණ බලයන්ට සෝපාන කැබ් රථයේ අවසර පත්‍රය ප්‍රදර්ශනය කිරීමට අවශ්‍ය වන අතර, වෙනත් අධිකරණ බලයන් මඟින් මෙහෙයුම් බලපත්‍රය වෙනත් තැනක ලිපිගොනු තුළ තබා ගැනීමට ඉඩ ලබා දේ",1731
732,732,"මෙය ගුවන්ගත කිරීම් සහ ගොඩබෑම විශාල සංඛ්‍යාවක් සඳහා හේතු වන අතර ගොඩබෑමට පෙර ගුවන් ගමන් රඳවා ගැනීමේ රටාව ප්‍රමාද වීම අසාමාන්‍ය දෙයක් නොවේ. ගුවන්තොටුපලේ ප්‍රධාන සැලැස්මට අනුව ඉන්ෆ්‍රීරෝ දෙවන ධාවන පථයක් 2006 දී නිම කරන ලදී. 2007 දී ගුවන් තොටුපල මගීන් 11,119,872 ක් හැසිරවිය. වර්ග මීටර් 12 දහසක් සහිත ප්‍රධාන ගොඩනැගිල්ලේ තුන්වන මහලේ පරිදර්ශක තට්ටුවක්, ආහාර මළුව, සාප්පු, 500 ක ධාරිතාවයකින් යුත් සිනමාහල් හතරක් සහ ප්‍රදර්ශන සඳහා ඉඩකඩ ඇත. බ්‍රසීලියා ගුවන්තොටුපළේ විකුණුම්කරුවන්ගේ ඉඩ 136 ක් ඇත. ගුවන්තොටුපල බ්‍රසීලියාවේ මධ්‍යම ප්‍රදේශයෙන් කිලෝමීටර් 11 ක් (සැතපුම් 6.8) පමණ මෙට්‍රෝ පද්ධතියෙන් පිටත පිහිටා ඇත. ගුවන්තොටුපලේ ප්‍රධාන ගේට්ටුවෙන් පිටත ප්‍රදේශය කුලී රථ මෙන්ම බස්රථ සේවා කිහිපයකින් සමන්විත වන අතර එය ගුවන්තොටුපළ බ්‍රසීලියා මධ්‍යම දිස්ත්‍රික්කයට සම්බන්ධ කරයි. වාහන නැවැත්වීමේ ස්ථානයේ කාර් 1200 ක් ඇත. ජාත්‍යන්තර ගුවන් යානා ගණනාවකට අමතරව දේශීය හා ප්‍රාදේශීය ගුවන් සමාගම් (ටැම්, ජීඕඑල්, අසුල්, වෙබ්ජෙට්, ට්‍රිප් සහ අවියන්කා) ගුවන්තොටුපළට සේවය සපයයි. 2012 දී බ්‍රසීලියානු ජාත්‍යන්තර ගුවන්තොටුපළ බ්‍රසීලියානු ඉංජිනේරු සමාගමක් වන එන්ජෙවික්ස් සහ ආර්ජන්ටිනාවේ කෝපරේෂන් ඇමරිකා හිමිකාර සමාගම විසින් පිහිටුවන ලද ඉන්ෆ්‍රැමෙරිකා සම්මේලනය විසින් 50% බැගින් කොටස් හිමිකර ගන්නා ලදී. වසර 25 ක සහනය තුළ ගුවන්තොටුපළ වසරකට මගීන් මිලියන 40 ක් දක්වා පුළුල් කළ හැකිය. වසර 25 ක සහනය තුළ ගුවන්තොටුපළ වසරකට මගීන් මිලියන 40 ක් දක්වා පුළුල් කළ හැකිය.",බ්‍රසීලියා ගුවන් තොටුපලේ සිනමාහල් කීයක් තිබේද?,හතර,1732
733,733,"ඉන්දියාවේ, ඉන්දියානු මධ්‍යම චිත්‍රපට සහතික කිරීමේ මණ්ඩලය (සීබීඑෆ්සී) මොනිකා බෙලූචි, ඩැනියෙල් ක්‍රේග් සහ ලියා සෙඩොක්ස්ගේ සිප ගැනීමේ දර්ශන වාරණය කළ බව වාර්තා විය. ඔවුන් සියලු අසභ්‍ය වචන නිශ්ශබ්ද කළහ. මෙය අන්තර්ජාලය හරහා, විශේෂයෙන් ට්විටර් හි විවේචනයට ලක් විය. මෙය අන්තර්ජාලය හරහා, විශේෂයෙන් ට්විටර් හි විවේචනයට ලක් විය.",ඉන්දියානු වාරණය පිළිබඳව පැමිණිලි කිරීම සඳහා භාවිතා කළ සමාජ මාධ්‍ය වෙබ් අඩවිය කුමක්ද?,ට්විටර්.,1733
