,Unnamed: 0,context_translated,question_translated,text_translated,original_index
509,509,enantiornithes... සියලුම මාර්ග ඩීසී තෙවන දුම්රිය බවට පරිවර්තනය කළ යුතු බව 1926 දී නිවේදනය කරන ලද අතර අවසන් පොදු විදුලි සේවාව 1929 සැප්තැම්බර් මාසයේදී ක්‍රියාත්මක විය.,දකුණු දුම්රිය මාර්ගයේ 1925 දී විවෘත කරන ලද රේඛා දෙකෙහි භාවිතා කළ වෝල්ටීයතාවය කුමක්ද?,6.7 kV 25 Hz,1509
510,510,"ලන්ඩන් යනු ලෝකයේ ප්‍රධාන සම්භාව්‍ය හා ජනප්‍රිය සංගීත අගනගරයක් වන අතර ඊඑම්අයි සහ වෝනර් සංගීත කණ්ඩායම වැනි ප්‍රධාන සංගීත සංස්ථා මෙන්ම ගණන් කළ නොහැකි සංගීත කණ්ඩායම්, සංගීත ians යන් සහ කර්මාන්ත වෘත්තිකයින්ගේ නිවහන වේ. බාබිකන් කලා මධ්‍යස්ථානය (ලන්ඩන් සංධ්වනි වාද්‍ය වෘන්දයේ සහ ලන්ඩන් සංධ්වනි ගායනයේ ප්‍රධාන පදනම), කැඩෝගන් ශාලාව (රාජකීය ෆිල්හාර්මනික් වාද්‍ය වෘන්දය) සහ රාජකීය ඇල්බට් ශාලාව (ප්‍රොම්ස්) වැනි බොහෝ වාද්‍ය වෘන්දයන් සහ ප්‍රසංග ශාලා ද මෙම නගරය සතුය. ලන්ඩනයේ ප්‍රධාන ඔපෙරා නිවාස දෙක වන්නේ රාජකීය ඔපෙරා හවුස් සහ ලන්ඩන් කොලිසියම් ය. එක්සත් රාජධානියේ විශාලතම නල අවයව රාජකීය ඇල්බට් ශාලාවේ ඇත. අනෙකුත් වැදගත් උපකරණ ආසන දෙව්මැදුරේ සහ ප්‍රධාන පල්ලි වල ඇත. සංරක්ෂණාගාර කිහිපයක් නගරය තුළ ඇත: රාජකීය සංගීත ඇකඩමිය, රාජකීය සංගීත විද්‍යාලය, ගිල්ඩ්හෝල් සංගීත හා නාට්‍ය පාසල සහ ත්‍රිත්ව ලාබන්. සංරක්ෂණාගාර කිහිපයක් නගරය තුළ ඇත: රාජකීය සංගීත ඇකඩමිය, රාජකීය සංගීත විද්‍යාලය, ගිල්ඩ්හෝල් සංගීත හා නාට්‍ය පාසල සහ ත්‍රිත්ව ලාබන්.",ලන්ඩන් පදනම් කරගත් ඊඑම්අයි යනු කුමන කර්මාන්තය කෙරෙහි අවධානය යොමු කරන සංස්ථාවක් ද?,සංගීත,1510
511,511,"සංගීත... වඩාත් මෑතකදී, ඉස්ලාමීය අධ්‍යයන පිළිබඳ ඔක්ස්ෆර්ඩ් මධ්‍යස්ථානයේ පර්යේෂකයෙකු වන මොහමඩ් අක්‍රම් නඩ්වි නම් විශාරදයා මුආඩිතිත් (ආදත්හි කාන්තා විද්වතුන්) පිළිබඳ වෙළුම් 40 ක් ලියා ඇති අතර අවම වශයෙන් 8,000 ක් පමණ සොයාගෙන ඇත.",1200 ට පෙර අධ්‍යාපනය ලැබූ ඉස්ලාමීය කාන්තාවන්ගේ ප්‍රතිශතය කුමක්ද?,සියයට එකකට වඩා අඩුය,1511
512,512,"(ලා (සංස්කෘත) හෝ සලා (පාලි) සාමාන්‍යයෙන් ඉංග්‍රීසි භාෂාවට පරිවර්තනය කරනු ලබන්නේ “ගුණවත් හැසිරීම”, “සදාචාරය”, “සදාචාරාත්මක විනය”, “ආචාර ධර්ම” හෝ “ශික්ෂා පද” ලෙසිනි. එය ශරීරය, කථාව හෝ මනස හරහා කරන ලද ක්‍රියාවක් වන අතර එය හිතාමතාම උත්සාහයක් දරයි. එය භාවිතයන් තුනෙන් එකකි (සලා, සමාධි, සහ පා ññā) සහ දෙවන පරාමිතිය. එය යොමු දක්වන්නේ චින්තනයේ, වචනයේ සහ ක්‍රියාවෙහි සදාචාරාත්මක පාරිශුද්ධ භාවයයි. ආලා හි කොන්දේසි හතර නම් නිර්මලකම, සන්සුන්කම, නිශ්ශබ්දතාවය සහ නිවා දැමීමයි. (ලා (සංස්කෘත) හෝ සලා (පාලි) සාමාන්‍යයෙන් ඉංග්‍රීසි භාෂාවට පරිවර්තනය කරනු ලබන්නේ “ගුණවත් හැසිරීම”, “සදාචාරය”, “සදාචාරාත්මක විනය”, “ආචාර ධර්ම” හෝ “ශික්ෂා පද” ලෙසිනි. එය ශරීරය, කථාව හෝ මනස හරහා කරන ලද ක්‍රියාවක් වන අතර එය හිතාමතාම උත්සාහයක් දරයි. එය භාවිතයන් තුනෙන් එකකි (සලා, සමාධි, සහ පා ññā) සහ දෙවන පරාමිතිය. එය යොමු දක්වන්නේ චින්තනයේ, වචනයේ සහ ක්‍රියාවෙහි සදාචාරාත්මක පාරිශුද්ධ භාවයයි. ආලා හි කොන්දේසි හතර නම් නිර්මලකම, සන්සුන්කම, නිශ්ශබ්දතාවය සහ නිවා දැමීමයි.",සීලා දෙවැන්න කුමක්ද?,pāramitā,1512
513,513,"මුලින් ලන්ඩනයේ බ්‍රිතාන්‍ය ගෘහ නිර්මාණ ශිල්පීන්ගේ ආයතනය ලෙස නම් කරන ලද මෙය 1834 දී පිලිප් හාඩ්වික්, තෝමස් ඇලෝම්, විලියම් ඩොන්තෝර්න්, තෝමස් ලිවර්ටන් ඩොනල්ඩ්සන්, විලියම් ඇඩම්ස් නිකල්සන්, ජෝන් බූනරෝටි පැප්වර්ත් සහ තෝමස් ඩි ග්‍රේ, 2 වන අර්ල් ඩි අළු.",බ්‍රිතාන්‍ය ගෘහ නිර්මාණ ශිල්පීන්ගේ ආයතනය පිහිටා තිබුණේ කුමන නගරයේද?,ලන්ඩන්,1513
514,514,"එදිනෙදා දකුණු කොරියානු සමාජයේ හැන්ගුල් පමණක් භාවිතා කිරීම කෙරෙහි පැහැදිලි ප්‍රවණතාවක් පවතී. හන්ජා තවමත් යම් දුරකට භාවිතා වේ, විශේෂයෙන් පුවත්පත්, මංගල උත්සව, ස්ථාන නම් සහ අක්ෂර වින්‍යාසය (එය එදිනෙදා ජපන් සමාජයේ කන්ජි භාවිතයේ ප්‍රමාණයට ආසන්න නැතත්). ශාස්ත්‍රීය පත්‍රිකා, ඉහළ මට්ටමේ ආයතනික වාර්තා, රජයේ ලියකියවිලි සහ පුවත්පත් වැනි අවිනිශ්චිතතාවයන් වළක්වා ගත යුතු අවස්ථාවන්හිදී ද හංජා බහුලව භාවිතා වේ; මෙයට හේතුව චීන වචන විශාල වශයෙන් ණයට ගැනීම නිසා ඇති වූ සමජාතීයතාවයන් විශාල සංඛ්‍යාවක් වීමයි. ශාස්ත්‍රීය පත්‍රිකා, ඉහළ මට්ටමේ ආයතනික වාර්තා, රජයේ ලියකියවිලි සහ පුවත්පත් වැනි අවිනිශ්චිතතාවයන් වළක්වා ගත යුතු අවස්ථාවන්හිදී ද හංජා බහුලව භාවිතා වේ; මෙයට හේතුව චීන වචන විශාල වශයෙන් ණයට ගැනීම නිසා ඇති වූ සමජාතීයතාවයන් විශාල සංඛ්‍යාවක් වීමයි.",විශේෂ experts යින්ට අනුව තවමත් භාවිතා කරන්නේ කුමක්ද?,හංජා,1514
515,515,"හංජා... ටක්සන් සමාගම් 150 ක් පමණ දෘෂ්ටි හා දෘෂ්ටි ඉලෙක්ට්‍රොනික් පද්ධති සැලසුම් කිරීම හා නිෂ්පාදනය කිරීම සඳහා සම්බන්ධ වී ඇති අතර ටක්සන්ට ""ඔප්ටික්ස් නිම්නය"" යන අන්වර්ථ නාමය උපයා ඇත.",ටක්සන්වල ප්‍රධාන වශයෙන් සිටින drug ෂධ සමාගම කුමක්ද?,සනෝෆි-ඇවෙන්ටිස්,1515
516,516,"ඇන්ජියෝස්පර්ම් ලෙස විශ්වාසයෙන් හඳුනාගෙන ඇති පැරණිතම මැක්‍රොෆොසිලය වසර මිලියන 125 ක් පමණ බීපී (ක්‍රිටේසියස් යුගය) දක්වා දිවෙන අතර ඇන්ජියෝස්පර්ම් සම්භවයක් ඇති පරාග පොසිල වාර්තාව වසර මිලියන 130 ක් පමණ බීපී දක්වා දිව යයි. කෙසේ වෙතත්, එක් අධ්‍යයනයකින් කියැවෙන්නේ සාම්ප්‍රදායිකව ජින්ගෝ වර්ගයක් ලෙස සැලකෙන මුල්-මැද ජුරාසික් ශාකය වන ෂ්මයිස්නෙරියා, පැරණිතම ඇන්ජියෝස්පර්ම් හෝ අවම වශයෙන් සමීප .ාතියෙකු විය හැකි බවයි. මීට අමතරව, මීට වසර මිලියන 250 කට පමණ පෙර ඇන්ජියෝස්පර්ම් පැවතීම සඳහා අවස්ථානුකූල රසායනික සාක්ෂි සොයාගෙන ඇත. බොහෝ සපුෂ්ප ශාක විසින් නිපදවන ද්විතියික පරිවෘත්තීය ඔලියානේන්, එම යුගයේ පර්මියන් නිධිවල සහ ගිගන්ටොප්ටෙරයිඩ් පොසිල සමඟ සොයාගෙන ඇත. ගිගන්ටොප්ටෙරයිඩ් යනු වඳ වී ගිය බීජ පැල සමූහයකි, ඒවා මල් පිපෙන ශාක සමඟ බොහෝ රූප විද්‍යාත්මක ගති ලක්ෂණ බෙදා ගනී. ගිගන්ටොප්ටෙරයිඩ් යනු වඳ වී ගිය බීජ පැල සමූහයකි, ඒවා මල් පිපෙන ශාක සමඟ බොහෝ රූප විද්‍යාත්මක ගති ලක්ෂණ බෙදා ගනී.",පැරණිතම ඇන්ජියෝස්පර්ම් යනු කුමක්ද?,පුරාවිද්‍යාව liaoningensis,1516
517,517,"එක්සත් ජනපද ගුවන් හමුදා යෝග්‍යතා පරීක්ෂණය (AFFT) සැලසුම් කර ඇත්තේ USAF හි ගුවන් භටයින්ගේ උදරයේ වට ප්‍රමාණය, මාංශ පේශි ශක්තිය / විඳදරාගැනීම සහ හෘද වාහිනී ශ්වසන යෝග්‍යතාවය පරීක්ෂා කිරීම සඳහා ය. ෆිට් ටු ෆයිට් වැඩසටහනේ කොටසක් ලෙස යූඑස්ඒඑෆ් වඩාත් දැඩි ශාරීරික යෝග්‍යතා තක්සේරුවක් අනුගමනය කළේය; නව යෝග්‍යතා වැඩසටහන 2010 ජුනි 1 වන දින සිට ක්‍රියාත්මක විය. යූඑස්ඒඑෆ් විසින් වසර ගණනාවක් තිස්සේ භාවිතා කරන ලද වාර්ෂික එර්ගෝ-චක්‍රීය පරීක්ෂණය 2004 දී ප්‍රතිස්ථාපනය කරන ලදි. ඒඑෆ්එෆ්ටී හි, ගුවන් භටයින්ට සංරචක හතරකින් සමන්විත කාර්ය සාධනය මත පදනම්ව ලකුණු ලබා දෙනු ලැබේ: ඉණ වට ප්‍රමාණය, වාඩි වීම, තල්ලු කිරීම සහ සැතපුම් 1.5 (කි.මී. 2.4) ධාවනය. ගුවන් භටයින්ට ලකුණු 100 ක් උපයා ගත හැකි අතර, ධාවන ගණන 60% ක් ලෙසද, ඉණ වට ප්‍රමාණය 20% ක් ලෙසද, ශක්ති පරීක්ෂණ දෙකම 10% බැගින් ගණනය කළ හැකිය. සමත් ලකුණු ලකුණු 75 කි. 2010 ජූලි 1 වන දින සිට බලපැවැත්වෙන පරිදි AFFT පරිපාලනය කරනු ලබන්නේ මූලික යෝග්‍යතා තක්සේරු කොටුව (FAC) විසිනි. එය වසරකට දෙවරක් අවශ්‍ය වේ. ඔහු හෝ ඇය 90% ට වඩා වැඩි ලකුණු ලබා ගන්නේ නම් පිරිස් වසරකට වරක් පරීක්ෂා කළ හැකිය. මීට අමතරව, මෙම එක් එක් පරීක්ෂණයෙහි අවම ප්‍රමිතීන් සපුරාලීමෙන් පමණක් ඔබට 75% ක සාමාර්ථයක් නොලැබෙන අතර ඕනෑම එක් අංගයක් අසමත් වීමෙන් සමස්ත පරීක්ෂණයම අසමත් වේ. මීට අමතරව, මෙම එක් එක් පරීක්ෂණයෙහි අවම ප්‍රමිතීන් සපුරාලීමෙන් පමණක් ඔබට 75% ක සාමාර්ථයක් නොලැබෙන අතර ඕනෑම එක් අංගයක් අසමත් වීමෙන් සමස්ත පරීක්ෂණයම අසමත් වේ.",යූඑස්ඒඑෆ් හි ගුවන් භටයින්ගේ යෝග්‍යතාවය පරීක්ෂා කිරීම සඳහා නිර්මාණය කර ඇති පරීක්ෂණය කුමක්ද?,එක්සත් ජනපද ගුවන් හමුදා යෝග්‍යතා පරීක්ෂණය,1517
518,518,එක්සත් ජනපද ගුවන් හමුදා යෝග්‍යතා පරීක්ෂණය... වොලර් මෙම සොයා ගැනීම සාමාන්‍යකරණය කළ අතර නූතන සමලිංගික අයිතිවාසිකම් ව්‍යාපාරයේ කොටසක් ලෙස දේශපාලන politicians යින්ට සහ මහජනයාට “අපි [සමලිංගිකයන් හා සමලිංගිකයන්] සෑම තැනකම සිටින බව” ඒත්තු ගැන්වීමට භාවිතා කළෙමු.,70 දශකයේ දී බ ru ස් වොලර් විසින් පවත්වාගෙන ගිය මිථ්‍යාව කුමක්ද?,සමලිංගිකත්වයේ ව්‍යාප්තිය මුළු ජනගහනයටම 10% කි,1518
519,519,සමලිංගිකත්වයේ ව්‍යාප්තිය මුළු ජනගහනයටම 10% කි 1945 සිට 1965 දක්වා කාලය තුළ එක්සත් රාජධානියෙන් පිටත බ්‍රිතාන්‍ය පාලනය යටතේ සිටි පුද්ගලයින්ගේ සංඛ්‍යාව මිලියන 700 සිට මිලියන පහ දක්වා පහත වැටුණු අතර ඔවුන්ගෙන් මිලියන තුනක් හොංකොං හි සිටියහ.,එක්සත් ජනපදය බ්‍රිතාන්‍යයට විශාල ණයක් ලබා දුන්නේ කවදාද?,1946,1519
520,520,"සෝනි දෝෂයක් ඇති බව සනාථ කළ අතර ඔවුන් කියා සිටියේ මෙම ගැටළුව පටු කරන බවත් සේවා යථා තත්ත්වයට පත් කිරීම සඳහා අඛණ්ඩව කටයුතු කරන බවත්ය. 2010 මාර්තු 2 වන විට (යූටීසී) මුල් පීඑස් 3 මාදිලිවල හිමිකරුවන්ට පීඑස්එන් සමඟ සාර්ථකව සම්බන්ධ විය හැකි අතර ඔරලෝසුව 1999 දෙසැම්බර් 31 දිනට නොපෙන්වයි. දිනය ගබඩා කිරීමේ BCD ක්‍රමය. කෙසේ වෙතත්, සමහර පරිශීලකයින් සඳහා, දෘඩාංගයේ මෙහෙයුම් පද්ධති ඔරලෝසුව (ප්‍රධාන වශයෙන් අන්තර්ජාලයෙන් යාවත්කාලීන කර ඇති අතර අභ්‍යන්තර ඔරලෝසුව සමඟ සම්බන්ධ නොවේ) අතින් යාවත්කාලීන කිරීම හෝ අන්තර්ජාලය හරහා එය නැවත සමමුහුර්ත කිරීම අවශ්‍ය වේ. කෙසේ වෙතත්, සමහර පරිශීලකයින් සඳහා, දෘඩාංගයේ මෙහෙයුම් පද්ධති ඔරලෝසුව (ප්‍රධාන වශයෙන් අන්තර්ජාලයෙන් යාවත්කාලීන කර ඇති අතර අභ්‍යන්තර ඔරලෝසුව සමඟ සම්බන්ධ නොවේ) අතින් යාවත්කාලීන කිරීම හෝ අන්තර්ජාලය හරහා එය නැවත සමමුහුර්ත කිරීම අවශ්‍ය වේ.",,පද්ධති ඔරලෝසුව සමඟ ඇති ගැටළුව සෝනි නිවැරදි කළේ කුමන දිනයෙන්ද? 2010 මාර්තු 2 (යූටීසී),1520
521,521,"පද්ධති ඔරලෝසුව සමඟ ඇති ගැටළුව සෝනි නිවැරදි කළේ කුමන දිනයෙන්ද? 2010 මාර්තු 2 (යූටීසී)... රොබෝ නිෂ්පාදනය සමඟ, වර්ණ උළු බෆරයට පටවනු ලැබේ, පසුව සැලසුම් මෘදුකාංගයේ විධාන ගොනුවකට අනුව රොබෝවරයා උළු තෝරාගෙන තනි තනිව තබයි.",රොබෝවරයා එය තබන උළු තෝරා ගන්නේ කෙසේද?,රොබෝවරයා එය තබන උළු තෝරා ගන්නේ කෙසේද?...,1521
522,522,විධාන ගොනුවක් ඔහුගේ ප්‍රතිවාදීන් උදාසීන වීමත් සමඟ නසාර් ඊජිප්තුවේ අවිවාදිත නායකයා බවට පත්විය.,ඊජිප්තුවේ සම්පූර්ණ පාලනය භාරගත්තේ කවුද?,නසාර්,1522
523,523,නසාර් 14 වන ශතවර්ෂයේ ඉතිරි කාලය පුරාම වසංගතය නැවත පැමිණීම නිසා කොන්දේසි තවදුරටත් නොවිසඳී ගියේය. සෙසු මධ්‍යතන යුගයේ දී එය වරින් වර යුරෝපයට පහර දුන්නේ ය.,මෙම කාලය තුළ ප්‍රංශයේ සිදු වූ ජනප්‍රිය නැගිටීම් මොනවාද?,ජැකරි,1523
524,524,"ජැකරි... නිකලස් ලෙසාර්ඩ් ලියූ පරිදි, මෙම කාල වකවානුවේ සංගීතය “තමන් විසින්ම යෝජනා කරන ඕනෑම සංගීත හැකියාවක් සඳහා විවෘතව පැවතුනි, එය බොහෝ විට මස්තිෂ්ක ය යන අර්ථයෙන් පමණක් එකමුතු විය. , හෝ පොප් ගීතයක් සෑදීමේදී මෙන් ඔවුන් සිතීමට පෙළඹවීම "".",පොප් ගීත සමඟ විනෝද වීමට වඩා පශ්චාත්-පන්ක් යුගයේ කලාකරුවන් තම ප්‍රේක්ෂකයින්ට කිරීමට වැඩි කැමැත්තක් දැක්වූයේ කුමක් ද?,කරදරකාරී,1524
525,525,කරදරකාරී... එහි ප්‍රති result ලය වූයේ එංගලන්තයේ එක්සත් ග්‍රෑන්ඩ් ලොජ් විසින් ප්‍රංශයේ ග්‍රෑන්ඩ් ඔරියන්ට් පිළිගැනීම ඉවත් කර ගැනීමයි.,ෆ්‍රීමසොන්සරි ආගමක් නොවන බවට තීන්දු කළ වර්ෂය කුමක්ද?,1875,1525
526,526,"සැලකිය යුතු ආදි ශිෂ්‍යයින් අතර: ෆෝඩ් මෝටර් සමාගමේ හිටපු සභාපති සහ ප්‍රධාන විධායක ඇලන් මුලාලි (බීඑස් / එම්එස්), නෙට්ස්කේප් හි සම නිර්මාතෘ සහ ලින්ක්ස් වෙබ් බ්‍රව්සරයේ කතුවරයා වන ලූ මොන්ටුලි, ගූගල්හි ඉංජිනේරු වීපී, බ්‍රයන් මැක්ලෙන්ඩන් (බීඑස්ඊඊ 1986) චාල්ස් ඊ. ස්පාර් (1934), ඔහියෝහි ස්ටෑන්ඩර්ඩ් ඔයිල් හි හිටපු ප්‍රධාන විධායක නිලධාරී.",කැන්සාස් විශ්ව විද්‍යාලයේ ආදි ශිෂ්‍යයෙකු වන තෙල් සමාගම් නායකයා කවුද?,චාල්ස් ඊ,1526
527,527,චාල්ස් ඊ... පසුකාලීන හුසයිට් යුද්ධ අභ්‍යන්තර ආරවුල් හේතුවෙන් බිඳ වැටුණු අතර චෙක් ජාතිකයින්ට ආගමික හෝ ජාතික ස්වාධීනත්වයක් ඇති නොවූ නමුත් කතෝලික පල්ලිය සහ රට තුළ ජර්මානු මූලද්‍රව්‍යය දුර්වල විය.,ජෑන් හුස් තමාගේම ඉගැන්වීම් පදනම් කරගත්තේ කාගේ ඉගැන්වීම්ද?,ජෝන් වයික්ලිෆ්,1527
