,original_index,context_translated,question_translated,text_translated
251,15251,"සිටි ඇන්ඩ් ගිල්ඩ්ස් විද්‍යාලය 1876 දී ආරම්භ කරන ලද්දේ කාර්මික අධ්‍යාපනයේ දියුණුව සඳහා (සීජීඑල්අයි) ලන්ඩන් නගරයේ සැපයුම් සමාගම් 16 ක රැස්වීමකිනි. එහි අරමුණ වූයේ ශිල්පීන්, කාර්මික ශිල්පීන්, තාක්‍ෂණ විද්‍යා ologists යින් සහ ඉංජිනේරුවන්ගේ පුහුණුව වැඩි දියුණු කිරීමයි. ප්‍රධාන අරමුණු දෙක වූයේ ලන්ඩනයේ මධ්‍යම ආයතනයක් ඇති කිරීම සහ තාක්ෂණික විෂයයන් සඳහා සුදුසුකම් ලැබීමේ විභාග ක්‍රමයක් පැවැත්වීමයි. සැලකිය යුතු වෙබ් අඩවියක් සොයා ගැනීමට ඔවුන්ට ඇති නොහැකියාව හමුවේ, සමාගම් අවසානයේ විද්‍යා හා කලා දෙපාර්තමේන්තුවේ ලේකම් ජෙනරාල් ශ්‍රීමත් ජෝන් ඩොනලි (රාජකීය ඉංජිනේරුවරයෙකු) විසින් අක්කර අසූ හතක (350,000) තම ආයතනය සොයා ගැනීමට පෙළඹුණි. m²) සවුත් කෙන්සිංටන් හි පිහිටි වෙබ් අඩවිය 1851 ප්‍රදර්ශන කොමසාරිස්වරුන් විසින් (GBP 342,500 සඳහා) 'කලාව හා විද්‍යාව සඳහා' සදාකාලිකව මිලදී ගන්නා ලදී. අවසාන විද්‍යාල දෙක රාජකීය ප්‍ර ter ප්තිය විසින් ඉම්පීරියල් විද්‍යා හා තාක්ෂණ විද්‍යාලයට ඇතුළත් කරන ලද අතර සීජීඑල්අයි මධ්‍යම කාර්මික විද්‍යාලය 1907 දී නගරය සහ ගිල්ඩ් විද්‍යාලය ලෙස නම් කරන ලද නමුත් 1910 වන තෙක් ඉම්පීරියල් විද්‍යාලයට ඇතුළත් නොවීය. අවසාන විද්‍යාල දෙක රාජකීය ප්‍ර ter ප්තිය විසින් ඉම්පීරියල් විද්‍යා හා තාක්ෂණ විද්‍යාලයට ඇතුළත් කරන ලද අතර සීජීඑල්අයි මධ්‍යම කාර්මික විද්‍යාලය 1907 දී නගරය සහ ගිල්ඩ් විද්‍යාලය ලෙස නම් කරන ලද නමුත් 1910 වන තෙක් ඉම්පීරියල් විද්‍යාලයට ඇතුළත් නොවීය.",සිටි ඇන්ඩ් ගිල්ඩ්ස් විද්‍යාලය ආරම්භ කරන විට එහි අරමුණ කුමක්ද?,"ශිල්පීන්, කාර්මික ශිල්පීන්, තාක්‍ෂණ විද්‍යා ologists යින් සහ ඉංජිනේරුවන්ගේ පුහුණුව වැඩි දියුණු කිරීම"
252,15252,"සංක්‍රමණික මාර්ග ඔස්සේ දඩයම් කිරීම සමහර පක්ෂි විශේෂයන්ට තර්ජනය කරයි. විශේෂයෙන් ඇෆ්ගනිස්ථානයේ සහ මධ්‍යම ආසියාවේ දඩයම් කිරීම හේතුවෙන් ඉන්දියාවේ ශීත කළ සයිබීරියානු දොඹකරවල (ලියුකොජෙරනස් ලියුකොජෙරනස්) ජනගහනය අඩු විය. කුරුල්ලන් අවසන් වරට දැක ඇත්තේ 2002 දී කියෝලාඩියෝ ජාතික වනෝද්‍යානයේ ඔවුන්ගේ ප්‍රියතම ශීත ground තු ක්‍රීඩාංගණයේදීය. විදුලි රැහැන්, සුළං ගොවිපලවල් සහ අක්වෙරළ තෙල් රිග් වැනි ව්‍යුහයන් සංක්‍රමණික පක්ෂීන්ට බලපාන බව දන්නා කරුණකි. වෙනත් සංක්‍රමණික උපද්‍රවයන් අතර දූෂණය, කුණාටු, ලැව්ගිනි සහ සංක්‍රමණික මාර්ගවල වාසස්ථාන විනාශ කිරීම, සංක්‍රමණිකයින්ට ආහාර නැවැත්වීමේ ස්ථානවලදී ප්‍රතික්ෂේප කිරීම ඇතුළත් වේ. නිදසුනක් වශයෙන්, නැගෙනහිර ආසියානු-ඔස්ට්‍රේලියානු ගුවන් පාලමේ, කහ මුහුදේ සංක්‍රමණික බාධකයේ ප්‍රධාන අන්තර්වාර වාසස්ථාන වලින් 65% ක් 1950 ගණන්වල සිට විනාශ වී ඇත. නිදසුනක් වශයෙන්, නැගෙනහිර ආසියානු-ඔස්ට්‍රේලියානු ගුවන් පාලමේ, කහ මුහුදේ සංක්‍රමණික බාධකයේ ප්‍රධාන අන්තර්වාර වාසස්ථාන වලින් 65% ක් 1950 ගණන්වල සිට විනාශ වී ඇත.",සමහර පක්ෂි විශේෂවලට තර්ජනය කරන්නේ කුමක්ද?,සංක්‍රමණික මාර්ග ඔස්සේ දඩයම් කිරීම
253,15253,"චීනයේ උතුරට වන්නට, සියොන්ග්නූ අධිපතියා වූ මෝඩු චන්යූ (ක්‍රි.පූ. 209–174) යුරේසියානු ස්ටෙප් හි නැගෙනහිර කොටසෙහි වාසය කරන විවිධ ගෝත්‍රිකයන් යටත් කර ගත්තේය. ඔහුගේ පාලන කාලය අවසන් වන විට ඔහු මැන්චූරියාව, මොන්ගෝලියාව සහ තාරිම් ද්‍රෝණිය පාලනය කළේය. සමර්කන්ඩ්ට නැගෙනහිරින් ප්‍රාන්ත විස්සකට යටත් විය. උතුරු දේශසීමා දිගේ සියොන්ග්නූ වෙත වෙළඳාම් කරන ලද බහුල හැන් නිෂ්පාදිත යකඩ ආයුධ ගැන ගාඕසු අධිරාජ්‍යයා කලබල වූ අතර ඔහු කණ්ඩායමට එරෙහිව වෙළඳ තහනමක් ඇති කළේය. සම්බාධක පැනවුවද, සියොන්ගු වෙළඳුන් ඔවුන්ගේ අවශ්‍යතා සපුරාලීමට කැමති බව සොයා ගත්තේය. දේශසීමා වෙලඳපොලවල වෙළඳාම් කළ සියොන්ග්නුට එරෙහිව චීන හමුදා ද විස්මිත ප්‍රහාර එල්ල කළහ. ඊට පළිගැනීමක් වශයෙන්, සියොන්ගු දැන් ෂැන්සි පළාත ආක්‍රමණය කළ අතර එහිදී ක්‍රි.පූ 200 දී බයිඩෙන්ග්හිදී හැන් හමුදා පරාජය කරන ලදී. සාකච්ඡාවලින් පසුව, ක්‍රි.පූ. 198 දී සිදු වූ හෙකින් ගිවිසුම, සියොන්ග්නු සහ හාන් නායකයින් රාජකීය විවාහ සන්ධානයක සමාන හවුල්කරුවන් ලෙස නාමිකව තබා ගත් නමුත්, සේද ඇඳුම්, ආහාර සහ වයින් වැනි කප්පම් භාණ්ඩ විශාල ප්‍රමාණයක් යැවීමට හාන්ට බල කෙරුනි. සියොන්ග්නු. සාකච්ඡාවලින් පසුව, ක්‍රි.පූ. 198 දී සිදු වූ හෙකින් ගිවිසුම, සියොන්ග්නු සහ හාන් නායකයින් රාජකීය විවාහ සන්ධානයක සමාන හවුල්කරුවන් ලෙස නාමිකව තබා ගත් නමුත්, සේද ඇඳුම්, ආහාර සහ වයින් වැනි කප්පම් භාණ්ඩ විශාල ප්‍රමාණයක් යැවීමට හාන්ට බල කෙරුනි. සියොන්ග්නු.",සියොන්ග්නු හි අධිපතියා කවුද?,මෝඩු චන්යූ
254,15254,මෙම දෙවිවරුන් මූලික දේවස්ථානයක් පිහිටුවා ගත්හ. ඊට අමතරව සුළු අය සිය ගණනක් සිටියහ. මේ අනුව සුමේරියානු දෙවිවරුන්ට විවිධ නගර සමඟ ඇසුරු කළ හැකි අතර ඔවුන්ගේ ආගමික වැදගත්කම බොහෝ විට එම නගරවල දේශපාලන බලය සමඟ හීන වී ගියේය. දෙවිවරු මිනිසුන්ට මැටිවලින් මැවූයේ ඔවුන්ට සේවය කිරීම සඳහා යැයි කියනු ලැබේ. පන්සල් වාරිමාර්ග කෘෂිකර්මාන්තයට අවශ්‍ය මහා ශ්‍රම ව්‍යාපෘති සංවිධානය කළේය. පන්සලට රිදී ගෙවීමකින් වැළකී සිටිය හැකි වුවද පුරවැසියන්ට ශ්‍රම රාජකාරියක් තිබුණි. පන්සලට රිදී ගෙවීමකින් වැළකී සිටිය හැකි වුවද පුරවැසියන්ට ශ්‍රම රාජකාරියක් තිබුණි.,දෙවිවරුන් මැටිවලින් මිනිසුන් මැව්වේ ඇයි?,ඔවුන්ට සේවය කිරීමේ අරමුණින්
255,15255,"ලෙම්ල්, කනිෂ් the චිත්‍රාගාරය සඳහා සුවිශේෂී ස්ථානයක් නිර්මාණය කළ අතර එය 1940 දශකය දක්වා විහිදුණු ත්‍රාසජනක චිත්‍රපට මාලාවක් ඇරඹීය. ඒ අතර ෆ්‍රැන්කන්ස්ටයින් (1931), ඩ්‍රැකියුලා (1931 දී ද), ද මමී (1932) සහ ද අදෘශ්‍ය මිනිසා (1933) ඇතුළත් වේ. මෙම කාල පරිච්ඡේදයේ අනෙකුත් ලෙම්ල් නිෂ්පාදන අතරට අනුකරණය කිරීම (1934) සහ මයි මෑන් ගොඩ්ප්‍රි (1936) ඇතුළත් වේ. මෙම කාල පරිච්ඡේදයේ අනෙකුත් ලෙම්ල් නිෂ්පාදන අතරට අනුකරණය කිරීම (1934) සහ මයි මෑන් ගොඩ්ප්‍රි (1936) ඇතුළත් වේ.",අදෘශ්‍යමාන මිනිසා සාදන ලද්දේ කුමන වර්ෂයේදීද?,1933
256,15256,"1854 වසන්තයේදී රුසියානුවන් නැවතත් ඩැනියුබ් ගඟ තරණය කර තුර්කි පළාතේ ඩොබ්රුජා වෙත පැමිණියහ. 1854 අප්රේල් වන විට රුසියානුවන් ට්රාජන්ගේ තාප්පයට ළඟා වූ අතර අවසානයේ ඔවුන් නතර විය. මධ්‍යයේ රුසියානු හමුදා ඩැනියුබ් තරණය කර හමුදා භටයන් 60,000 ක් සමඟ අප්‍රේල් 14 සිට සිලිස්ට්‍රා වටලනු ලැබූ අතර, 15,000 ක් සිටි ආරක්ෂකයින්ට මාස තුනක් සඳහා සැපයුම් තිබුණි. : 415 1854 ජුනි 23 වන දින වටලෑම ඉවත් කරන ලදී. මේ අවස්ථාවේ දී ඉංග්‍රීසි හා ප්‍රංශ හමුදාවන්ට උපකරණ නොමැතිකම නිසා පිට්ටනියට යාමට නොහැකි විය. : 415 : 415",සිලිස්ට්‍රාට පහර දෙන විට රුසියානුවන්ට මිනිස් හමුදා සිටියේ කෙසේද?,"භටයන් 60,000 ක්"
257,15257,"2003-04 අධ්‍යයන වර්ෂය තුළ හාවඩ් විශ්ව විද්‍යාලයේ අප්‍රිකානු ඇමරිකානු ආදි ශිෂ්‍යයින් සඳහා නැවත එක්වීමේ කමිටු සාකච්ඡාවකදී, ආයතනයේ ප්‍රමුඛ කළු මහාචාර්යවරුන් දෙදෙනෙකු වන ලානි ගිනියර් සහ හෙන්රි ලුවී ගේට්ස් හාවඩ්හි ස්ථිර ක්‍රියාකාරී ප්‍රතිපත්තිවල අනපේක්ෂිත බලපෑමක් පෙන්වා දුන්හ. ඔවුන් කියා සිටියේ කළු හාවඩ් උපාධි අපේක්ෂකයින්ගෙන් තුනෙන් එකක් පමණ අප්‍රිකානු ඇමරිකානු ප්‍රජාවට ආච්චිලා සීයලා සිව්දෙනා උපත ලැබූ පවුල්වල අය බවයි. හාවඩ් හි කළු ජාතික සිසුන්ගෙන් බහුතරය කැරිබියානු සහ අප්‍රිකානු සංක්‍රමණිකයන් හෝ ඔවුන්ගේ දරුවන් වන අතර තවත් සමහරු බිරාස් යුවලගේ මිශ්‍ර ජාතියේ දරුවන් ය. පරම්පරා ගණනාවක් තිස්සේ එක්සත් ජනපදයේ මුතුන් මිත්තන් සිටි කළු පවුලක සවුත් බ්‍රොන්ක්ස් හි උපත ලැබූ එක් හාවඩ් සිසුවෙක් පැවසුවේ African තිහාසික අප්‍රිකානු ඇමරිකානු ප්‍රජාවෙන් හාවඩ් සිසුන් ඉතා ස්වල්ප දෙනෙකු සිටින බවත් ඔවුන් “පැවත එන්නන්” ලෙස හැඳින්වීමට ගත් බවත්ය. එනම් ඇමරිකානු වහලුන්ගෙන් පැවත එන්නන්). African තිහාසික අප්‍රිකානු ඇමරිකානුවන් මෙම rep න ලෙස නිරූපණය කිරීමට හේතු සහ කළ හැකි පිළියම් විවාදයට භාජනය වේ. African තිහාසික අප්‍රිකානු ඇමරිකානුවන් මෙම rep න ලෙස නිරූපණය කිරීමට හේතු සහ කළ හැකි පිළියම් විවාදයට භාජනය වේ.","අප්‍රිකානු ඇමරිකානුවන්ගේ අඩු නියෝජනය සඳහා හේතු හැරුණු විට, විවාදයට තවමත් ඉතිරිව ඇත්තේ කුමක්ද?",හැකි පිළියම්
258,15258,"පෝර්ෆිරියානු පාලනයේ මෙම යුගයේදී නගරය පුළුල් නවීකරණයකට භාජනය විය. 1908 වන විට බොහෝ ස්පා Spanish ් Col යටත්විජිත ශෛලියේ ගොඩනැගිලි විනාශ වූ අතර නව විශාල පෝර්ෆිරියන් ආයතන වෙනුවට බොහෝ ග්‍රාමීය කලාප නාගරික හෝ කාර්මික දිස්ත්‍රික්ක බවට පරිවර්තනය කරන ලදී. , කර්මාන්තශාලා සහ දැවැන්ත පොදු වැඩ, සමහර විට පෝර්ෆිරියානු නවීකරණයේ වඩාත්ම දිගු කාලීන බලපෑම් වූයේ කොලෝනියා රෝමා ප්‍රදේශය නිර්මාණය කිරීම සහ ප්‍රතිසංස්කරණ මාවත සංවර්ධනය කිරීමයි. මෙක්සිකෝ නගරයේ බොහෝ ප්‍රධාන ආකර්ශන සහ බිම් සලකුණු මෙම යුගය තුළ මෙම ශෛලිය තුල ඉදිකරන ලද්දකි. මෙක්සිකෝ නගරයේ බොහෝ ප්‍රධාන ආකර්ශන සහ බිම් සලකුණු මෙම යුගය තුළ මෙම ශෛලිය තුල ඉදිකරන ලද්දකි.",පුළුල් නවීකරණය ආරම්භ වූයේ කුමක් සමඟද?,ස්පා Spanish ් Col යටත්විජිත ශෛලියේ බොහෝ ගොඩනැගිලි විනාශ විය
259,15259,"18 වන සියවසේ සිට ඇල්ප්ස් කඳුකරයේ පවතින දරුණු කාලගුණය අධ්‍යයනය කර ඇත. විශේෂයෙන් සෘතුමය සීතල සුළං වැනි කාලගුණ රටා. දේශගුණ විද්‍යා ologists යින් සඳහා අඛණ්ඩ දත්ත සපයන 20 වන සියවසේ මුල් භාගයේ දී බොහෝ කාලගුණ මධ්‍යස්ථාන කඳුකරයේ ස්ථානගත කරන ලදී. ඉතාලියේ අවෝස්ටා නිම්නය, ප්‍රංශයේ මොරියන්, ස්විට්සර්ලන්තයේ වලයිස් සහ උතුරු ටයිරෝල් වැනි සමහර නිම්න තරමක් ශුෂ්ක ය. ඉතාලියේ අවෝස්ටා නිම්නය, ප්‍රංශයේ මොරියන්, ස්විට්සර්ලන්තයේ වලයිස් සහ උතුරු ටයිරෝල් වැනි සමහර නිම්න තරමක් ශුෂ්ක ය.",විසිවන සියවසේ මුල් භාගයේ කඳුකරයේ තැබූ දේ කුමක්ද?,බොහෝ කාලගුණ මධ්‍යස්ථාන
260,15260,"ජර්මානු සුපිරි රාජ්‍යයට ස්පා Spanish ් and හා කැටලන් භාෂාවෙන් විවිධ ප්‍රති come ල ලැබී තිබේ. නිදසුනක් ලෙස, ජර්මානු සම්භවයක් ඇති කැටලන් ෆැන්ග් ""මඩ"" සහ රොස්ටීර් ""රෝස්ට්"", ස්පා Spanish ් lod ලොඩෝ සහ ලතින් සම්භවයක් ඇති අසාර්ට වඩා වෙනස් ය; ලතින් සම්භවයක් ඇති කැටලන් ෆිලෝසා “භ්‍රමණය වන රෝදය” සහ ජර්මානු සම්භවයක් ඇති ස්පා Spanish ් ru රුකා සහ සීන් වලට වඩා වෙනස් ය. නිදසුනක් ලෙස, ජර්මානු සම්භවයක් ඇති කැටලන් ෆැන්ග් ""මඩ"" සහ රොස්ටීර් ""රෝස්ට්"", ස්පා Spanish ් lod ලොඩෝ සහ ලතින් සම්භවයක් ඇති අසාර්ට වඩා වෙනස් ය; ලතින් සම්භවයක් ඇති කැටලන් ෆිලෝසා “භ්‍රමණය වන රෝදය” සහ ජර්මානු සම්භවයක් ඇති ස්පා Spanish ් ru රුකා සහ සීන් වලට වඩා වෙනස් ය.",ස්පා Spanish ් in භාෂාවෙන් නොව කැටලන් භාෂාවෙන් සොයාගත් භාෂා මූලද්‍රව්‍යයන්ගේ මූලාරම්භය කුමක්ද?,ජර්මානු
261,15261,"සමුරායිවරයෙකුට උපභාර්යාවන් ගත හැකි නමුත් ඔවුන්ගේ පසුබිම් ඉහළ පෙළේ සමුරායිවරුන් විසින් පරීක්ෂා කරන ලදී. බොහෝ අවස්ථාවලදී උපභාර්යාවක් ගැනීම විවාහයකට සමානයි. උපභාර්යාවක් පැහැර ගැනීම ප්‍රබන්ධයේ පොදු වුවත් අපරාධයක් නොවන්නේ නම් එය ලැජ්ජාවකි. උපභාර්යාව සාමාන්‍ය පුද්ගලයෙක් නම්, ඇගේ දෙමව්පියන්ගේ පිළිගැනීම ඉල්ලා සිටීම සඳහා විවාහක මුදල් හෝ බදු නිදහස් කිරීම සඳහා පණිවිඩයක් යවා ඇත. කාන්තාව නීත්‍යානුකූල භාර්යාවක් නොවුවද, සාමාන්‍යයෙන් එය අවමානයක් ලෙස සලකනු ලැබුවද, බොහෝ ධනවත් වෙළෙන්දෝ විශ්වාස කළේ සමුරායිවරයෙකුගේ උපභාර්යාවක් වීම සාමාන්‍ය පුද්ගලයෙකුගේ නීත්‍යානුකූල බිරිඳ වීමට වඩා උසස් බවය. වෙළෙන්දෙකුගේ දියණියක සමුරායිවරයකු සමඟ විවාහ වූ විට, ඇගේ පවුලේ මුදල් සමුරායිවරුන්ගේ ණය මකා දැමූ අතර සමුරායිවරුන්ගේ සමාජ තත්වය වෙළඳ පවුලේ තත්වය වැඩිදියුණු කළේය. සමුරායිවරයෙකුගේ සාමාන්‍ය උපභාර්යාවක් පුතෙකු බිහි කළහොත්, පුතාට තම පියාගේ සමාජ තත්වය උරුම කර ගත හැකිය. සමුරායිවරයෙකුගේ සාමාන්‍ය උපභාර්යාවක් පුතෙකු බිහි කළහොත්, පුතාට තම පියාගේ සමාජ තත්වය උරුම කර ගත හැකිය.",උපභාර්යාවක් වීම බිරිඳක් වීමට වඩා හොඳ යැයි සිතුවේ කවුද?,බොහෝ ධනවත් වෙළෙන්දෝ
