,original_index,context_translated,question_translated,text_translated
381,15382,"නගරය ආසන්න වශයෙන් ගැඹුරු කැනන් හා කඳු 200 ක් පමණ පිහිටා ඇති අතර එහි මීසා වෙන් කරමින් ස්වාභාවික විවෘත අවකාශයේ කුඩා සාක්කු නගරය පුරා විසිරී ඇති අතර එය කඳුකර භූගෝලයක් ලබා දෙයි. සාම්ප්‍රදායිකව සැන් ඩියාගන් වැසියන් තම නිවෙස් සහ ව්‍යාපාර මෙසා මත ගොඩනඟා ඇති අතර නාගරික කැනියාවන් සාපේක්ෂව වල් වී ඇත. මේ අනුව, කැනියොන්ස් නගරයේ සමහර කොටස් වලට ඛණ්ඩනය වන හැඟීමක් ලබා දෙන අතර, වෙනත් අසල්වැසි ප්‍රදේශ අතර පරතරයන් නිර්මාණය කර අඩු dens නත්වයකින් යුත් කාර් කේන්ද්‍රීය පරිසරයකට දායක වේ. සැන් ඩියාගෝ ගඟ නැගෙනහිර සිට බටහිරට සැන් ඩියාගෝ මැදින් දිවෙන අතර ගංගා නිම්නයක් නිර්මාණය කරමින් නගරය උතුරු හා දකුණු කොටස් වලට බෙදීමට උපකාරී වේ. පැරණිතම ස්පා Spanish ් exp ගවේෂකයන්ගේ අවධානය යොමු වූයේ ගංගාව සැන් ඩියාගෝ බොක්ක වෙත ගලා යාමටය. [උපුටා දැක්වීම අවශ්‍යයි] ජලාශ කිහිපයක් සහ මිෂන් ට්‍රේල්ස් ප්‍රාදේශීය උද්‍යානය ද නගරයේ සංවර්ධිත ප්‍රදේශ අතර පිහිටා ඇත. [උපුටා දැක්වීම අවශ්‍යයි] ජලාශ කිහිපයක් සහ මිෂන් ට්‍රේල්ස් ප්‍රාදේශීය උද්‍යානය ද නගරයේ සංවර්ධිත ප්‍රදේශ අතර පිහිටා ඇත.",නගරයේ උතුරු හා දකුණු කොටස් බෙදන්නේ කුමක් ද?,සැන් ඩියාගෝ ගඟ
382,15383,"පළමුවන ලෝක සංග්‍රාමයෙන් පසු බ්‍රොන්ක්ස් වේගවත් නාගරික වර්ධනයකට භාජනය විය. නිව් යෝර්ක් නගරයේ උමං මාර්ග පුළුල් කිරීම ජනගහනය වැඩිවීමට දායක වූ අතර දහස් ගණනක් සංක්‍රමණිකයන් බ්‍රොන්ක්ස් වෙත පැමිණීම නිසා නේවාසික ඉදිකිරීම්වල විශාල වර්ධනයක් සිදුවිය. මෙම කණ්ඩායම් අතර බොහෝ අයර්ලන්ත ඇමරිකානුවන්, ඉතාලි ඇමරිකානුවන් සහ විශේෂයෙන් යුදෙව් ඇමරිකානුවන් මෙහි පදිංචි වූහ. ඊට අමතරව ප්‍රංශ, ජර්මානු, පෝලන්ත සහ වෙනත් සංක්‍රමණිකයන් නගරයට සංක්‍රමණය විය. මෙම කාලය තුළ යුදෙව් ජනගහනය ද සැලකිය යුතු ලෙස වැඩි විය. 1937 දී, යුදෙව් සංවිධානවලට අනුව, යුදෙව්වන් 592,185 ක් ද බ්‍රොන්ක්ස් හි ජීවත් වූහ (නගර ජනගහනයෙන් 43.9%), 2011 දී යුදෙව්වන් 54,000 ක් පමණක් ජීවත් විය. . බොහෝ සිනගෝග තවමත් බ්‍රොන්ක්ස් හි පවතී, නමුත් බොහෝ ඒවා වෙනත් භාවිතයන් බවට පරිවර්තනය කර ඇත.",1937 දී බ්‍රොන්ක්ස් හි යුදෙව්වන් කී දෙනෙක් ජීවත් වූවාද?,"592,185 කි"
383,15384,"1990 දශකය, වස්තු-නැඹුරු වැඩසටහන්කරණය ඉහළ යාමත් සමඟ විවිධ දත්ත සමුදායන්හි දත්ත හසුරුවන ආකාරයෙහි වර්ධනයක් දක්නට ලැබුණි. ක්‍රමලේඛකයින් සහ නිර්මාණකරුවන් ඔවුන්ගේ දත්ත සමුදායන්හි ඇති දත්ත වස්තු ලෙස සැලකීමට පටන් ගත්හ. එනම්, පුද්ගලයෙකුගේ දත්ත දත්ත ගබඩාවක තිබේ නම්, එම පුද්ගලයාගේ ලිපිනයන්, දුරකථන අංකය සහ වයස වැනි ගුණාංග දැන් බාහිර දත්ත වෙනුවට එම පුද්ගලයාට අයත් යැයි සැලකේ. දත්ත අතර සම්බන්ධතා වස්තූන් හා ඒවායේ ගුණාංග අතර සම්බන්ධතා මිස තනි ක්ෂේත්‍රයන්ට සම්බන්ධ වීමට මෙය ඉඩ දෙයි. ""වස්තු-සම්බන්ධතා සම්බාධනය නොගැලපීම"" යන යෙදුම මඟින් වැඩසටහන්ගත කරන ලද වස්තු සහ දත්ත සමුදා වගු අතර පරිවර්ථනයේ ඇති අපහසුතාවය විස්තර කරන ලදී. වස්තු දත්ත සමුදායන් සහ වස්තු-සම්බන්ධතා දත්ත සමුදායන් මෙම ගැටළුව විසඳීමට උත්සාහ කරන්නේ වස්තු-නැඹුරු භාෂාවක් (සමහර විට SQL වෙත දිගු කිරීමක් ලෙස) ලබා දීමෙනි. ක්‍රමලේඛන පැත්තෙන්, වස්තු-සම්බන්ධතා සිතියම් (ORM) ලෙස හැඳින්වෙන පුස්තකාල එකම ගැටළුව විසඳීමට උත්සාහ කරයි. ක්‍රමලේඛන පැත්තෙන්, වස්තු-සම්බන්ධතා සිතියම් (ORM) ලෙස හැඳින්වෙන පුස්තකාල එකම ගැටළුව විසඳීමට උත්සාහ කරයි.",දත්ත සමුදා වගුවේ සහ ක්‍රමලේඛිත වස්තු පරිවර්තනයේ දුෂ්කරතාව සඳහා භාවිතා කරන පදය කුමක්ද?,වස්තු-සම්බන්ධතා සම්බාධනය නොගැලපීම
384,15385,"ජුලියස් සීසර් යටතේ ජර්මානු ගෝත්‍රිකයන් සහ රෝමයේ හමුදා අතර ඇති වූ ගැටුම් නිසා ප්‍රධාන ජර්මානු ගෝත්‍රිකයින්ට රයින්හි නැගෙනහිර ඉවුරට පසුබැසීමට සිදුවිය. ක්‍රි.පූ 12 දී රෝම අධිරාජ්‍යයා වූ ඔගස්ටස් ජර්මානුවන් යටත් කර ගැනීමට නියෝග කළ නමුත් ටියූටෝබර්ග් වනාන්තර සටනේදී ව්‍යසනකාරී රෝම පරාජයේ ප්‍රති ulted ලය වූයේ රෝම අධිරාජ්‍යය ජර්මනිය සම්පූර්ණයෙන්ම යටත් කර ගැනීමේ සැලසුම් අතහැර දැමීමයි. රෝමානු භූමියේ සිටි ජර්මානු ජනයා සංස්කෘතික වශයෙන් රෝමකරණයට ලක් වූ අතර, ජර්මනියේ වැඩි කොටසක් සෘජු රෝම පාලනයෙන් තොර වුවද, රෝමය ජර්මානු සමාජයේ දියුණුවට බෙහෙවින් බලපෑවේය, විශේෂයෙන් රෝමවරුන්ගෙන් එය ලබාගත් ජර්මානුවන් විසින් ක්‍රිස්තියානි ධර්මය පිළිගැනීම. ජර්මානු ජනගහනය සහිත රෝම පාලනය යටතේ පැවති ප්‍රදේශවල ජර්මානු සහ රෝම ජනයා අවිවාහක වූ අතර රෝමානු, ජර්මානු සහ ක්‍රිස්තියානි සම්ප්‍රදායන් එකිනෙකට සම්බන්ධ විය. ක්‍රිස්තියානි ධර්මය පිළිගැනීම පසුකාලීනව පොදු ජර්මානු අනන්‍යතාවයක් වර්ධනය කිරීම සඳහා විශාල බලපෑමක් බවට පත්විය. ක්‍රිස්තියානි ධර්මය පිළිගැනීම පසුකාලීනව පොදු ජර්මානු අනන්‍යතාවයක් වර්ධනය කිරීම සඳහා විශාල බලපෑමක් බවට පත්විය.",ජර්මානුවන් යටත් කර ගැනීමට නියෝග කළ රෝම අධිරාජ්‍යයා කවුද?,ඔගස්ටස්
385,15386,"මයිස් වැන් ඩර් රෝහි, පිලිප් ජොන්සන් සහ මාසෙල් බ u යර් වැනි ගෘහ නිර්මාණ ශිල්පීන් ගොඩනැගිලි ද්‍රව්‍යවල සහ නවීන ඉදිකිරීම් ශිල්පීය ක්‍රමවල ආවේණික ගුණාංග මත පදනම්ව අලංකාරය නිර්මාණය කිරීමට කටයුතු කළහ, සරල කළ ජ්‍යාමිතික ආකෘති සඳහා සාම්ප්‍රදායික forms තිහාසික ආකෘතීන් වෙළඳාම් කිරීම, කාර්මිකයන් විසින් කළ හැකි නව ක්‍රම සහ ක්‍රම සැමරීම. ඉහළ මට්ටමේ සුපිරි ව්‍යුහයන් බිහි කළ වානේ රාමු ඉදිකිරීම ඇතුළු විප්ලවය. ශතවර්ෂයේ මැද භාගය වන විට නූතනවාදය අන්තර්ජාතික ශෛලියට හැඩ ගැසී ඇත. මයිනෝ යමාසාකි විසින් නිර්මාණය කරන ලද නිව්යෝක් හි ලෝක වෙළඳ මධ්‍යස්ථානයේ නිවුන් කුලුනු විසින් විවිධාකාරයෙන් නිරූපණය කරන ලද සෞන්දර්යය. ශතවර්ෂයේ මැද භාගය වන විට නූතනවාදය අන්තර්ජාතික ශෛලියට හැඩ ගැසී ඇත. මයිනෝ යමාසාකි විසින් නිර්මාණය කරන ලද නිව්යෝක් හි ලෝක වෙළඳ මධ්‍යස්ථානයේ නිවුන් කුලුනු විසින් විවිධාකාරයෙන් නිරූපණය කරන ලද සෞන්දර්යය.",නව ක්‍රම සහ ක්‍රම මගින් ගෘහ නිර්මාණ ශිල්පය සැලසුම් කිරීමට හැකි වූයේ කුමක්ද?,කාර්මික විප්ලවය
386,15387,"අකිරා හිමේකාවා විසින් රචනා කරන ලද සහ නිදර්ශනය කරන ලද ජපානයේ සුවිශේෂී මැංගා මාලාවක් 2016 පෙබරවාරි 8 වන දින නිකුත් කරන ලදී. මෙම කතා මාලාව තනිකරම ලබා ගත හැක්කේ ප්‍රකාශක ෂෝගකුකන්ගේ මංගා ඕන් ජංගම යෙදුම හරහා පමණි. මංගා අනුවර්තනය ආරම්භ වූයේ එය පදනම් වූ ක්‍රීඩාව මුලින් නිකුත් වී වසර දහයකට පමණ පසුව වුවද, එය දියත් කළේ අධි-විභේදන ප්‍රතිනිර්මාණය නිකුත් කිරීමට මාසයකට පෙර ය. මංගා අනුවර්තනය ආරම්භ වූයේ එය පදනම් වූ ක්‍රීඩාව මුලින් නිකුත් වී වසර දහයකට පමණ පසුව වුවද, එය දියත් කළේ අධි-විභේදන ප්‍රතිනිර්මාණය නිකුත් කිරීමට මාසයකට පෙර ය.",ට්විටයිට් ප්‍රින්සස් විකට පොත් මාලාවක් සඳහා චිත්‍ර ලිවීම සහ සැපයීම කළේ කවුද?,අකිරා හිමේකාවා
387,15388,"2007 ජුලි 8 වන දින වොෂිංටන් පෝස්ට් විසින් යූසීඑල්ඒ මහාචාර්ය ඇමී සෙගාර්ට්ගේ ස්පයිං බ්ලින්ඩ්: ද සීඅයිඒ, එෆ්බීඅයි සහ 9/11 හි මූලාරම්භය යන ග්‍රන්ථවල උපුටා ගැනීම් ප්‍රකාශයට පත් කරන ලදී. 2001 සැප්තැම්බර් 11 ත‍්‍රස්ත ප‍්‍රහාර කඩාකප්පල් කිරීමට සීඅයිඒ සහ එෆ්බීඅයි විසින් සිදුවිය හැකි අවස්ථා 23 ක් මග හැරී ඇති බව රජයේ ලේඛනවලින් පෙනී යන බව සෙගාර්ට්ගේ පොතෙන් ද පෝස්ට් වාර්තා කළේය. උසස් කිරීම සඳහා නුසුදුසු දිරිගැන්වීම්; සහ එෆ්බීඅයි, සීඅයිඒ සහ එක්සත් ජනපද බුද්ධි ප්‍රජාව අතර සහයෝගීතාවයේ lack නතාවක්. විවිධ එෆ්බීඅයි කාර්යාල අතර communication ලදායී සන්නිවේදනයක් සහ සහයෝගීතාවයක් ඇතිවීම වළක්වන එෆ්බීඅයි හි විමධ්‍යගත ව්‍යුහයට මෙම පොත දොස් පැවරීය. වෙනස් වීමට ඇති ගැඹුරින් මුල්බැසගත් ඒජන්සියේ සංස්කෘතික ප්‍රතිරෝධය හේතුවෙන් එෆ්බීඅයි effective ලදායී ත්‍රස්ත විරෝධී හෝ බුද්ධි අංශයක් ලෙස පරිණාමය වී නැති බව පොත යෝජනා කරයි. නිදසුනක් ලෙස, විශේෂ නියෝජිතයින් හැර සෙසු සියලුම කාර්ය මණ්ඩලය සහායක කාර්ය මණ්ඩලය ලෙස සලකමින්, බුද්ධි විශ්ලේෂකයින් එෆ්බීඅයි හි ඔටෝ යාන්ත්‍රික හා මුරකරුවන් සමඟ වර්ගීකරණය කරයි. නිදසුනක් ලෙස, විශේෂ නියෝජිතයින් හැර සෙසු සියලුම කාර්ය මණ්ඩලය සහායක කාර්ය මණ්ඩලය ලෙස සලකමින්, බුද්ධි විශ්ලේෂකයින් එෆ්බීඅයි හි ඔටෝ යාන්ත්‍රික හා මුරකරුවන් සමඟ වර්ගීකරණය කරයි.",9/11 ප්‍රහාරය කඩාකප්පල් කිරීමට අවස්ථා කීයක් තිබේද?,23
388,15389,"පළමු ඇම්නියොට් මතු වී ඇත්තේ අග කාබනිෆරස් තුළ ය. ඔවුන් පැවත එන්නේ මීට පෙර කෘමීන් හා අනෙකුත් අපෘෂ් b වංශීන් මෙන්ම පර්ණාංග, පාසි සහ වෙනත් ශාක වාසය කළ භූමියේ ජීවත් වූ උරගයින්ගේ උභයජීවී ටෙට්‍රපොඩ් වලිනි. වසර මිලියන කිහිපයක් ඇතුළත, වැදගත් ඇම්නියොට් පරම්පරා දෙකක් පැහැදිලි විය: පසුකාලීනව ක්ෂීරපායීන්ගේ පොදු මුතුන් මිත්තන් ඇතුළත් වන උපාගම; අවසානයේදී කැස්බෑවන්, කටුස්සන්, සර්පයන්, කිඹුලන්, ඩයිනෝසෝරයන් සහ කුරුල්ලන් ඇතුළත් වන සෞරෝසිඩ්. සයිනැප්සිඩ් වල හිස් කබලේ සෑම පැත්තකින්ම තනි සිදුරක් (තාවකාලික විද ත්) ඇත. පළමු ඇම්නියොට් මතු වී ඇත්තේ අග කාබනිෆරස් තුළ ය. ඔවුන් පැවත එන්නේ මීට පෙර කෘමීන් හා අනෙකුත් අපෘෂ් b වංශීන් මෙන්ම පර්ණාංග, පාසි සහ වෙනත් ශාක වාසය කළ භූමියේ ජීවත් වූ උරගයින්ගේ උභයජීවී ටෙට්‍රපොඩ් වලිනි. වසර මිලියන කිහිපයක් ඇතුළත, වැදගත් ඇම්නියොට් පරම්පරා දෙකක් පැහැදිලි විය: පසුකාලීනව ක්ෂීරපායීන්ගේ පොදු මුතුන් මිත්තන් ඇතුළත් වන උපාගම; අවසානයේදී කැස්බෑවන්, කටුස්සන්, සර්පයන්, කිඹුලන්, ඩයිනෝසෝරයන් සහ කුරුල්ලන් ඇතුළත් වන සෞරෝසිඩ්. සයිනැප්සිඩ් වල හිස් කබලේ සෑම පැත්තකින්ම තනි සිදුරක් (තාවකාලික විද ත්) ඇත.",පළමු දන්නා ඇම්නියොට් හටගත්තේ කුමන කාල පරිච්ඡේදයේ සිටද?,කාබනිෆරස්
389,15390,"1978 දී ආදිවාසී ලේඛක කෙවින් ගිල්බට් විසින් ලිවිං බ්ලැක්: බ්ලැක්ස් ටෝක් ටු කෙවින් ගිල්බට් නම් ග්‍රන්ථය සඳහා ජාතික පොත් කවුන්සිලයේ සම්මානය ලබා ගත් අතර ආදිවාසී ජනතාවගේ කථා එකතුවකි. 1998 දී අභ්‍යන්තර සාහිත්‍ය සඳහා මානව හිමිකම් සම්මානය (නමුත් පිළිගැනීම ප්‍රතික්ෂේප කරන ලදී) බ්ලැක් ඕස්ට්‍රේලියාව, ආදිවාසී ඡායාරූපකරණයේ කාව්‍ය සංග්‍රහයක් සහ ප්‍රදර්ශනයක්. ආදිවාසී පරම්පරාවේ උපාධිය මත පදනම් වූ පෙර නිර්වචනවලට වෙනස්ව, 1990 දී ආදිවාසීන් පිළිබඳ නෛතික අර්ථ දැක්වීම රජය විසින් වෙනස් කරන ලදී. ආදිවාසී පරම්පරාවේ උපාධිය මත පදනම් වූ පෙර නිර්වචනවලට වෙනස්ව, 1990 දී ආදිවාසීන් පිළිබඳ නෛතික අර්ථ දැක්වීම රජය විසින් වෙනස් කරන ලදී.","""ලිවිං බ්ලැක්"" ලිව්වේ කවුද?",කෙවින් ගිල්බට්
390,15391,"මෙම ආකෘතියට බොහෝ විට නර්තන-පොප් (මැඩෝනා, චර්, ග්ලෝරියා එස්ටෙෆාන් සහ කයිලි මිනොග්ගේ උද්යෝගිමත් ගීත වැනි), පවර් පොප්ස් (ප්‍රධාන වශයෙන් බැක්ස්ට්‍රීට් බෝයිස් සහ වෙස්ට් ලයිෆ් වැනි බෝයිබෑන්ඩ් විසින්), සහ වැඩිහිටි-නැඹුරු මෘදු රොක් සංගීතය ඇතුළත් වේ. (සාමාන්‍යයෙන් එයරොස්මිත් [උපුටා දැක්වීම අවශ්‍යයි], ඊගල්ස්, ස්ටිං, ටෝටෝ සහ ද මූඩි බ්ලූස්). සාමාන්‍යයෙන්, හොට් ඒසී ගුවන්විදුලි මධ්‍යස්ථාන ඔවුන්ගේ සංගීත ප්‍රතිදානය 18-54 වයස් කාණ්ඩය වෙත ඉලක්ක කරන අතර පිරිමි සහ ගැහැණු යන දෙඅංශයේම සංඛ්‍යාලේඛන ප්‍රේක්ෂකයින් වේ. සාමාන්‍යයෙන්, හොට් ඒසී ගුවන්විදුලි මධ්‍යස්ථාන ඔවුන්ගේ සංගීත ප්‍රතිදානය 18-54 වයස් කාණ්ඩය වෙත ඉලක්ක කරන අතර පිරිමි සහ ගැහැණු යන දෙඅංශයේම සංඛ්‍යාලේඛන ප්‍රේක්ෂකයින් වේ.",වෙස්ට් ලයිෆ් විසින් වාදනය කරනු ලබන සංගීත ප්‍රභේදය කුමක්ද?,බලය ඉස්මතු වේ
391,15392,"එසෝටරික් හෝ සුෆි අර්ථ නිරූපණය අල් කුර්ආනයේ අභ්‍යන්තර අර්ථයන් හෙළි කිරීමට උත්සාහ කරයි. සූෆි දහම පැහැදිලි (සහීර්) පදයෙන් ඔබ්බට ගමන් කරන අතර ඒ වෙනුවට අල් කුර්ආන් වාක්‍ය අභ්‍යන්තර හෝ එසෝටරික් (බැටින්) හා සවි ness ානකත්වයේ සහ පැවැත්මේ පාරභෞතික මානයන් සමඟ සම්බන්ධ කරයි. සැන්ඩ්ස්ට අනුව, ප්‍රකාශනයට වඩා එසෝටරික් අර්ථ නිරූපණයන් යෝජනා කරයි, ඒවා පැහැදිලි කිරීම් (තෆ්සිර්) වලට වඩා ඇඟවුම් (ඉෂාරත්) වේ. ඔවුන් එක් එක් ලේඛකයාගේ තීක්ෂ්ණ බුද්ධිය විදහා දක්වන තරමටම හැකියාවන් දක්වයි. ඔවුන් එක් එක් ලේඛකයාගේ තීක්ෂ්ණ බුද්ධිය විදහා දක්වන තරමටම හැකියාවන් දක්වයි.",සෑන්ඩ්ස් පවසන්නේ සූෆි අර්ථ නිරූපණයන් සෘජු පැහැදිලි කිරීමකට වඩා කුමන සාහිත්‍යමය උපකරණය භාවිතා කරන බවයි?,යෝජනා
