,original_index,context_translated,question_translated,text_translated
128,15128,"වෙස්ටාල් යනු වෙස්ටා වගාව සඳහා කැප වූ කාන්තාවන් හය දෙනෙකුගේ පොදු පූජක තන්ත්‍රයක් වූ අතර රෝමානු රාජ්‍යයේ උදුනෙහි දේවතාවිය සහ එහි වැදගත් ගිනිදැල් විය. වෙස්ටල්වරියක් ලෙස තෝරාගත් ගැහැණු ළමයෙක් අද්විතීය ආගමික වෙනසක්, පොදු තත්වයක් සහ වරප්‍රසාද ලබා ගත් අතර සැලකිය යුතු දේශපාලන බලපෑමක් කළ හැකිය. ඇගේ කාර්යාලයට ඇතුළු වූ පසු වෙස්ටල්වරයෙකු ඇගේ පියාගේ අධිකාරියෙන් නිදහස් විය. පෞරාණික රෝමානු සමාජයේ, පුරුෂයෙකුගේ නෛතික භාරකාරත්වය යටතේ සිටිය යුතු එකම කාන්තාවන් මෙම පූජකවරුන් පමණක් නොව, පොන්ටිෆෙක්ස් මැක්සිමස්ට කෙලින්ම පිළිතුරු සපයයි. පෞරාණික රෝමානු සමාජයේ, පුරුෂයෙකුගේ නෛතික භාරකාරත්වය යටතේ සිටිය යුතු එකම කාන්තාවන් මෙම පූජකවරුන් පමණක් නොව, පොන්ටිෆෙක්ස් මැක්සිමස්ට කෙලින්ම පිළිතුරු සපයයි.",වෙස්ටල් කෙනෙකු වීමේ වාසිය කුමක්ද?,දේශපාලන බලපෑම
129,15129,"බොහෝ ව්‍යාංජනාක්‍ෂරවල තාලීකරණය මත පදනම්ව රුසියානු භාෂාව එහි වෙනස නිසා කැපී පෙනේ. / K /, / ɡ /, / x / do ට සමාන්තරගත ඇලෝෆෝන් [kʲ, ɡʲ, xʲ] ඇති අතර, / kʲ / පමණක් දුරකථන ඇමතුමක් ලෙස සැලකිය හැකිය, එය ආන්තික වන අතර සාමාන්‍යයෙන් සුවිශේෂී ලෙස නොසැලකේ (එකම දේශීය අවම යුගලය / kʲ / වෙනම දුරකථන ඇමතුමක් වීමට තර්ක කරන්නේ ""это ткёт"" ([ˈɛtə tkʲɵt], 'එය වියන') / ""этот кот"" ([ˈɛtət kot], 'මෙම පූසා')). පලටලීකරණය යනු ව්‍යාංජනාක්‍ෂර ප්‍රකාශ කිරීමේදී හා පසුව දිවේ කේන්ද්‍රය ඔසවා ඇති බවයි. / Tʲ / සහ / dʲ / සම්බන්ධයෙන් ගත් කල, දිව සුළු වශයෙන් iction ර්ෂණය (ශබ්ද ශබ්ද) නිපදවීමට තරම් ඉහළට ඔසවා ඇත. මෙම ශබ්ද: / t, d, ts, s, z, n සහ rʲ / යනු දන්ත වේ, එය උච්චාරණය කරනු ලබන්නේ දිවේ කෙළවරේ දත් වලට එරෙහිව නොව ඇල්වොලර් රිජ් වලට එරෙහිව ය. මෙම ශබ්ද: / t, d, ts, s, z, n සහ rʲ / යනු දන්ත වේ, එය උච්චාරණය කරනු ලබන්නේ දිවේ කෙළවරේ දත් වලට එරෙහිව නොව ඇල්වොලර් රිජ් වලට එරෙහිව ය.",/ Kʲ / සලකා බැලිය හැක්කේ කුමක් ද?,දුරකථන ඇමතුමක්
130,15130,"නූතන භාෂාවලින් ඇල්ප්, ඇල්ම්, ඇල්බේ හෝ ඇල්පේ යන යෙදුමෙන් අදහස් කරන්නේ ග්ලැසියරයට පහළින් ඇති ඇල්පයින් ප්‍රදේශවල තණබිම් මිස කඳු මුදුන් නොවේ. ඇල්ප් යනු උස් කඳුකර තණබිමක් වන අතර ගිම්හාන මාසවලදී එළදෙනුන් තණබිම් සඳහා ගෙන යනු ලබන අතර පිදුරු අාර් ඒන් සොයා ගත හැකි අතර කඳු ගැන සඳහන් වන “ඇල්ප්ස්” යන යෙදුම වැරදි නාමයකි. කඳු මුදුන් සඳහා වන පදය ජාතිය හා භාෂාව අනුව වෙනස් වේ: අං, කොගල්, ගිප්ෆෙල්, ස්පිට්ස් සහ බර්ග් වැනි වචන ජර්මානු කථාකරන ප්‍රදේශවල භාවිතා වේ: ප්‍රංශ කථාකරන ප්‍රදේශවල මොන්ට්, පික්, ඩෙන්ට් සහ අයිගුයිල්; සහ ඉතාලි කතා කරන ප්‍රදේශවල මොන්ටේ, පික්කෝ හෝ සිමා. කඳු මුදුන් සඳහා වන පදය ජාතිය හා භාෂාව අනුව වෙනස් වේ: අං, කොගල්, ගිප්ෆෙල්, ස්පිට්ස් සහ බර්ග් වැනි වචන ජර්මානු කථාකරන ප්‍රදේශවල භාවිතා වේ: ප්‍රංශ කථාකරන ප්‍රදේශවල මොන්ට්, පික්, ඩෙන්ට් සහ අයිගුයිල්; සහ ඉතාලි කතා කරන ප්‍රදේශවල මොන්ටේ, පික්කෝ හෝ සිමා.","අං, කොගල්, ජිප්ෆෙල්, ස්පිට්ස් සහ බර්ඩ් වැනි වචන භාවිතා කරන්නේ කුමන ප්‍රදේශවලද?",ජර්මානු කතා කරන කලාප
131,15131,"පන්දුව ක්‍රීඩා කරන අතරතුර අත් සහ දෑතින් ස්පර්ශ කිරීමට ඉඩ දී ඇති එකම ක්‍රීඩකයා ගෝල් රකින්නන් වන අතර ඔවුන්ගේ ද penalty ුවම් පහර සීමාව තුළ පමණි. පිටත ක්‍රීඩකයින් වැඩි වශයෙන් තම පාද පන්දුව පහර දීමට හෝ පසුකර යාමට භාවිතා කරන අතර ඒ වෙනුවට ඔවුන්ගේ හිස හෝ ඇඟිල්ල භාවිතා කරයි. තරගය අවසන් වන විට වැඩිම ගෝල ලබා ගන්නා කණ්ඩායම ජය ගනී. තරගය අවසානයේ ලකුණු මට්ටම නම්, එක්කෝ දිනුම් ඇදීමක් ප්‍රකාශයට පත් කරනු ලැබේ, නැතහොත් තරගය අමතර වේලාවක් සහ / හෝ ද penalty ුවම් පහරක් තරඟයේ ආකෘතිය අනුව වෙනස් වේ. ක්‍රීඩාවේ නීති මුලින් කේතනය කරන ලද්දේ 1863 දී පාපන්දු සංගමය විසිනි. සංගමයේ පාපන්දු ජාත්‍යන්තරව පාලනය කරනු ලබන්නේ අන්තර්ජාතික සංගම් පාපන්දු සම්මේලනය (FIFA; ප්‍රංශ: ෆෙඩරේෂන් ඉන්ටර්නැෂනල් ඩි පාපන්දු සංගමය) වන අතර එය පිරිමි සහ ගැහැණු යන දෙඅංශයෙන්ම ලෝක කුසලාන සංවිධානය කරයි. සෑම වසර හතරකට වරක්. ඇසෝසියේෂන් පාපන්දු ජාත්‍යන්තරව පාලනය කරනු ලබන්නේ අන්තර්ජාතික සංගම් පාපන්දු සම්මේලනය (FIFA; ප්‍රංශ: ෆෙඩරේෂන් ඉන්ටර්නැෂනල් ඩි පාපන්දු සංගමය) විසිනි, එය සෑම වසර හතරකට වරක් පිරිමි සහ ගැහැණු ළමයින් සඳහා ලෝක කුසලාන සංවිධානය කරයි.",ක්‍රීඩාවේ නීති පැමිණියේ කුමන රටෙන්ද?,එංගලන්තය
132,15132,"ව්යතිරේකයක් වන්නේ එක්සත් ජනපදය, 1995 ජුනි 8 ට පෙර ගොනු කරන ලද පේටන්ට් බලපත්රය පේටන්ට් බලපත්රය ප්රකාශයට පත් කළ දින සිට වසර 17 කට පසුව කල් ඉකුත් වන නමුත් අයදුම්පත් දිගු කිරීම නිසා පේටන්ට් බලපත්රය සාමාන්යයෙන් බලාපොරොත්තු වූවාට වඩා බොහෝ කලකට පසුව නිකුත් කිරීමට හැකි වේ (සබ්මැරීන් පේටන්ට් බලන්න). විවිධ එම්පී 3 සම්බන්ධ පේටන්ට් බලපත්‍ර 2007 සිට 2017 දක්වා එක්සත් ජනපද පේටන්ට් බලපත්‍රයේ කල් ඉකුත් වී ඇත. 1992 දෙසැම්බරය වන විට ගොනු කරන ලද දන්නා MP3 පේටන්ට් බලපත්‍ර පමණක් සලකා බැලුවහොත්, එම්පී 3 විකේතනය එක්සත් ජනපදයේ පේටන්ට් බලපත්‍ර රහිතව 2015 සැප්තැම්බර් 22 සිට එක්සත් ජනපද පේටන්ට් බලපත්‍රය 5,812,672 කල් ඉකුත් වූ අතර 1992 ඔක්තෝම්බර් මාසයේදී පීසීටී ගොනු කිරීමක් සිදු විය. ඉහත සඳහන් යොමු කිරීම් පියවරක් ලෙස ගනු ලැබේ, එම්පී 3 තාක්‍ෂණය 2017 දෙසැම්බර් 30 වන දින එක්සත් ජනපදයේ පේටන්ට් බලපත්‍ර රහිත වනු ඇත. එක්සත් ජනපද පේටන්ට් බලපත්‍රය 5,703,999, ෆ්‍රැන්හෝෆර්-ජෙසෙල්ෂාෆ්ට් විසින් දරනු ලබන අතර ටෙක්නිකොලර් විසින් පරිපාලනය කරනු ලැබේ. ඉහත සඳහන් යොමු වල සඳහන් දීර් est තම පේටන්ට් බලපත්‍රය පියවරක් ලෙස ගතහොත්, එම්පී 3 තාක්‍ෂණය 2017 දෙසැම්බර් 30 වන දින එක්සත් ජනපදයේ පේටන්ට් බලපත්‍ර රහිත වනු ඇත. එක්සත් ජනපද පේටන්ට් බලපත්‍රය 5,703,999, ෆ්‍රැන්හෝෆර්-ජෙසෙල්ෂාෆ්ට් විසින් දරනු ලබන අතර ටෙක්නිකොලර් විසින් පරිපාලනය කරනු ලැබේ. කල් ඉකුත් වේ.",MP3 ආශ්‍රිත පේටන්ට් බලපත්‍ර එක්සත් ජනපදයේ කල් ඉකුත් වන නවතම වසර කුමක්ද?,2017
133,15133,1981 සිට 1997 දක්වා කාලය තුළ පළමු කණ්ඩායම් තරග 751 ක් ක්‍රීඩා කර ඇති නෙවිල් සවුත්ල් වැඩිම එවර්ටන් දර්ශන සඳහා වාර්තාවක් තබා ඇති අතර මීට පෙර (15) කන්නයකදී වැඩිම ලීග් පිරිසිදු තහඩු සඳහා වාර්තාවක් තබා ඇත. 2008-09 සමයේදී මෙම වාර්තාව ඇමරිකානු ගෝල රකින්නා වන ටිම් හොවාර්ඩ් (17) විසින් පරාජය කරන ලදී. මැද භාගයේ අග භාගය සහ හිටපු නායක බ්‍රයන් ලැබෝන් 534 වතාවක් ක්‍රීඩා කර දෙවන ස්ථානයට පත්විය. දෙවන ලෝක සංග්‍රාමයේ දෙපැත්තෙන්ම 1929 සිට 1953 දක්වා වසර 23 ක් ක්‍රීඩා කළ ගෝල් කීපර් ටෙඩ් සාගර් වැඩිම කාලයක් සේවය කළ ක්‍රීඩකයා වේ. සියලුම තරඟ වලදී ගෝල 383 ක් ලබා ගනිමින් සමාජයේ ඉහළම ගෝල ලබා ගත් ක්‍රීඩකයා ඩික්සි ඩීන් ය; දෙවන වැඩිම ගෝල ලබා ගත් ක්‍රීඩකයා වන්නේ ග්‍රේම් ෂාප් 159 ක් ලබා ගනිමිනි. වාරයක් තුළ වැඩිම ගෝල සංඛ්‍යාවක් වාර්තා කළ ඉංග්‍රීසි ජාතික වාර්තාව ඩීන් තවමත් තබා ඇත.,එවර්ටන් පාපන්දු සමාජය සමඟ තරග 534 ක් ක්‍රීඩා කළ හිටපු නායකයා කවුද?,බ්‍රයන් ලැබෝන්
134,15134,"ඇමරිකානු අයිඩල් එහි අනුග්‍රාහකයන්ගේ ලාංඡනය සහ නිෂ්පාදන ප්‍රදර්ශනය කිරීම මුල් කාලයේ සිටම සටහන් විය. හයවන වාරය වන විට අයිඩල් විසින් නිෂ්පාදන ස්ථානගත කිරීම් 4,349 ක් පෙන්වන බව නීල්සන් මීඩියා රිසර්ච් පවසයි. සන්නාමගත විනෝදාස්වාද ඒකාබද්ධතාවය එහි දැන්වීම්කරුවන්ට ප්‍රයෝජනවත් බව ඔප්පු විය - ඡන්දය ප්‍රකාශ කිරීමේ මාධ්‍යයක් ලෙස AT&T කෙටි පණිවුඩකරණය ප්‍රවර්ධනය කිරීම තාක්‍ෂණය පුළුල් සංස්කෘතියට සාර්ථකව හඳුන්වා දුන් අතර ප්‍රදර්ශනය අතරතුර කොකාකෝලා එහි කොටස් ප්‍රමාණය ඉහළ ගොස් තිබේ. සන්නාමගත විනෝදාස්වාද ඒකාබද්ධතාවය එහි දැන්වීම්කරුවන්ට ප්‍රයෝජනවත් බව ඔප්පු විය - ඡන්දය ප්‍රකාශ කිරීමේ මාධ්‍යයක් ලෙස AT&T කෙටි පණිවුඩකරණය ප්‍රවර්ධනය කිරීම තාක්‍ෂණය පුළුල් සංස්කෘතියට සාර්ථකව හඳුන්වා දුන් අතර ප්‍රදර්ශනය අතරතුර කොකාකෝලා එහි කොටස් ප්‍රමාණය ඉහළ ගොස් තිබේ.",ඡන්දය ප්‍රකාශ කිරීමේ ක්‍රමයක් ලෙස ඇමරිකානු අයිඩල් සඳහා AT&T ප්‍රවර්ධනය කළ සේවය කුමක්ද?,පෙළ පණිවිඩ යැවීම
135,15135,"ඩෙට්රොයිට්හි මෙක්සිකානු-ඇමරිකානු ජනගහනයක් ඇත. විසිවන සියවසේ මුල් භාගයේදී මෙක්සිකානුවන් දහස් ගණනක් කෘෂිකාර්මික, මෝටර් රථ සහ වානේ රැකියා සඳහා ඩෙට්‍රොයිට් වෙත පැමිණියහ. 1930 ගණන්වල මෙක්සිකානු නැවත මෙරටට ගෙන්වා ගැනීමේදී ඩෙට්‍රොයිට් හි බොහෝ මෙක්සිකානුවන් කැමැත්තෙන් ආපසු මෙරටට ගෙන්වා ගැනීමට හෝ නැවත මෙරටට ගෙන්වා ගැනීමට බල කෙරුනි. 1940 දශකය වන විට මෙක්සිකානු ප්‍රජාව දැන් මෙක්සිකෝටවුන් ලෙස නම් කර ඇත. 1990 ගණන්වලදී ජාලිස්කෝ වෙතින් සංක්‍රමණය වීම හේතුවෙන් ජනගහනය සැලකිය යුතු ලෙස වැඩි විය. 2010 දී ඩෙට්රොයිට් හි හිස්පැනික්වරු 48,679 ක් සිටි අතර මෙක්සිකානුවන් 36,452 ක් ද වූහ. හිස්පැනික්වරුන්ගේ සංඛ්‍යාව 1990 දී 70% කින් වැඩි විය. හිස්පැනික්වරුන්ගේ සංඛ්‍යාව 1990 දී 70% කින් වැඩි විය.",බොහෝ මෙක්සිකානු ජාතිකයන් බලහත්කාරයෙන් ආපසු ගෙන්වා ගන්නා විට එය හැඳින්වූයේ කුමක්ද?,1930 ගණන්වල මෙක්සිකානු නැවත මෙරටට ගෙන්වා ගැනීම
136,15136,"තවත් පොදු යෙදුමක් වන්නේ විද්‍යුත් ආණ්ඩුකාරවරයකු සමඟ ඒකාබද්ධව අභ්‍යන්තර දහන එන්ජිමක තෙරපුම පාලනය කිරීමයි. මෙම භාවිතයේදී, ආණ්ඩුකාරවරයාගේ නිමැවුමට අනුකූලව තෙරපුම චලනය කිරීම සඳහා මෝටරය ආපසු එන වසන්තයකට එරෙහිව ක්‍රියා කරයි. ජ්වලන පද්ධතියෙන් හෝ චුම්බක පිකප් එකකින් විද්‍යුත් ස්පන්දන ගණනය කිරීමෙන් දෙවැන්න එන්ජින් වේගය අධීක්ෂණය කරන අතර වේගය අනුව මෝටරයට යොදන ධාරාවේ ප්‍රමාණයට කුඩා වෙනස් කිරීම් සිදු කරයි. අපේක්ෂිත වේගයට සාපේක්ෂව එන්ජිම මන්දගාමී වීමට පටන් ගන්නේ නම්, ධාරාව වැඩි වනු ඇත, මෝටරය වැඩි ව්‍යවර්ථයක් වර්ධනය කර, ආපසු එන වසන්තයට එරෙහිව ඇදගෙන තෙරපුම විවෘත කරයි. එන්ජිම වේගයෙන් ධාවනය වුවහොත්, ආණ්ඩුකාරවරයා විසින් මෝටරයට යොදන ධාරාව අඩු කරනු ඇත, එමඟින් ආපසු එන වසන්තය පසුපසට ඇදගෙන තෙරපුම වසා දමයි. එන්ජිම වේගයෙන් ධාවනය වුවහොත්, ආණ්ඩුකාරවරයා විසින් මෝටරයට යොදන ධාරාව අඩු කරනු ඇත, එමඟින් ආපසු එන වසන්තය පසුපසට ඇදගෙන තෙරපුම වසා දමයි.",ආණ්ඩුකාරවරයෙක් සම්බන්ධ වන්නේ කුමක් ද?,නැවත වසන්තය
137,15137,"ඕස්ට්‍රේලියාව: මෙම උත්සවය අප්‍රේල් 24 වන දින ඕස්ට්‍රේලියානු අගනුවර වන කැන්බරා හි පැවති අතර, ප්‍රතිසන්ධාන ස්ථානයේ සිට පොදුරාජ්‍ය මණ්ඩලීය උද්‍යානය දක්වා කැන්බරා හි මධ්‍යම ප්‍රදේශවලින් කිලෝමීටර 16 ක් පමණ ආවරණය විය. කැන්බරා නුවරට පැමිණි පසු ඔලිම්පික් ගින්න චීන නිලධාරීන් විසින් එන්ගුනවාල් ජනයාගේ ආදිවාසී වැඩිමහල්ලෙකු වන ඇග්නස් ෂියා වෙත පිළිගැන්වීය. සාමය සහ පිළිගැනීමේ ත්‍යාගයක් ලෙස ඇය ඔවුන්ට පණිවිඩ පොල්ලක් ඉදිරිපත් කළාය. ටිබෙට් ගැති විරෝධතාකරුවන් සිය ගණනක් සහ චීන සිසුන් දහස් ගණනක් සහභාගී වූ බව වාර්තා වේ. උද් demonst ෝෂකයින් සහ ප්‍රති-උද් rators ෝෂකයින් ඕස්ට්‍රේලියානු ෆෙඩරල් පොලිසිය විසින් වෙන් කරනු ලැබීය. චීන ගිනිදැල් සේවකයින්ගේ කාර්යභාරය පිළිබඳ මතභේදයක් හේතුවෙන් මෙම උත්සවය සඳහා වන සූදානම අඩපණ වූ අතර, ඕස්ට්‍රේලියානු සහ චීන නිලධාරීන් මාධ්‍ය හමුවක් අතරතුර ඔවුන්ගේ ක්‍රියාකාරිත්වය සහ පරමාධිපත්‍යය පිළිබඳව ප්‍රසිද්ධියේ තර්ක කළහ. චීන ගිනිදැල් සේවකයින්ගේ කාර්යභාරය පිළිබඳ මතභේදයක් හේතුවෙන් මෙම උත්සවය සඳහා වන සූදානම අඩපණ වූ අතර, ඕස්ට්‍රේලියානු සහ චීන නිලධාරීන් මාධ්‍ය හමුවක් අතරතුර ඔවුන්ගේ ක්‍රියාකාරිත්වය සහ පරමාධිපත්‍යය පිළිබඳව ප්‍රසිද්ධියේ තර්ක කළහ.",කැන්බරා හි චීන නිලධාරීන්ගෙන් ගින්න ලැබුවේ කවුද?,ඇග්නස් ෂියා
